,title,company,salary,description
0,Junior Flutter Developer,ADVISORY APPS SDN BHD,"RM 4,000 - RM 4,999 a month","Test and resolve bug issues.
Ensure app works across multiple devices.
Collaborate with cross-functional teams to define, design and ship new features."
1,Flutter Deveoper,Nezda Malaysia,"RM 3,000 - RM 8,000 a month",Develop state of the art highly interactive and rich animation experience for mobile and desktop app using Flutter.
2,Flutter Mobile App Developer,Ultranet Technologies Sdn Bhd,"RM 3,500 - RM 4,900 a month","Develop flutter application using Dart (Required).
Integrate mobile applications with backend RESTful services.
Work with outside data sources and APIs."
3,Flutter Developer,Brandt International Sdn Bhd,"RM 6,000 a month",Develop state of the art highly interactive and rich animation experience for mobile and desktop app using Flutter.
4,Flutter Mobile App Developer,Applify Technologies Sdn Bhd,"RM 3,500 - RM 4,900 a month","Develop flutter application using Dart (Required).
Architect, design, develop, and maintain Flutter applications.
Integrate various APIs from third parties."
5,Site Reliability Engineer,BIGPAY MALAYSIA SDN BHD,"RM 10,000 - RM 12,999 a month","When incidents occur, you will be on the front line of investigation and remediation and direct action from our backend, devops and other teams."
6,Internship for Mobile App Developer (Flutter),GTrade Technology Sdn Bhd,,"Design and develop state of the art highly interactive and rich animation experience for mobile using Flutter.
Job Types: Full-time, Internship."
7,Flutter Developer,UP DEVLABS SDN BHD,"RM 4,000 - RM 4,999 a month",Job Description: • Design and develop state of the art highly interactive and rich animation experience for mobile using Flutter.
8,Flutter Engineer,Bjak Sdn Bhd,"RM 4,000 - RM 12,000 a month","Bjak is focused on providing access to affordable and sustainable financial services for people in ASEAN.
Incorporate user feedback to improve software design…"
9,Web Front-End / Mobile Application Developer (Flutter),atQuest Solutions,,"Creates next generation mobile application for iOS and Android devices.
Responsible for the development, testing, release and support of the application’s…"
10,Flutter Developer,Snappymob,"RM 5,500 - RM 7,500 a month","Architect, design, develop, and maintain Flutter applications.
Collaborate with the engineering team at large in software design sessions, code reviews,…"
11,IT Intern,BestWeb Technologies Sdn Bhd,,"Support the Operation team in maintaining support ticketing system.
Assist with troubleshooting issues and provide technical support."
12,Junior Software Engineer,Auronex Sdn Bhd,"RM 3,000 - RM 3,499 a month",How old are you -What languages you code at the moment -How many years of working experience Our Tech Stacks: -NodeJS (ExpressJS) / Python(DJango) / Go /…
13,Mobile Application Developer ( Flutter),E-INFOMEDIA SOLUTIONS SDN BHD,"RM 6,000 - RM 7,999 a month","Work in cross-functional teams with project managers, designers and business stakeholders to ship mobile application on-quality and on-time."
14,Flutter Developer,EPS Malaysia,,"Design and develop high-volume, low-latency applications for mission-critical systems, delivering high-availability and performance."
15,Software Developer (Junior Executives/Fresh Graduates),WELORY SOLUTION PLT,"RM 3,000 - RM 3,500 a month","Develop, enhance and test customised software and mobile apps to meet the requirements.
Participates in the entire software development cycle."
16,IT Support,Lapasar.com,"RM 2,000 - RM 4,000 a month","To perform enhancement and defect fixing at the code level.
To work closely with internal and external users to understand their needs & issues."
17,Mobile Developer,Unijaya Resources Sdn. Bhd.,"RM 2,500 - RM 2,999 a month","Required Skill(s): Ionic, flutter, PHP, Laravel, Angular JS, Vue JS, React Preferably Junior Executive specialized in IT/Computer - Software or equivalent."
18,Junior Software Engineer,EBOSS INNOVATION SDN BHD,"RM 2,500 - RM 3,800 a month","A diploma or bachelor’s degree in Software Engineering, Computer Science or equivalent.
Sufficient understanding of HTML/CSS, Javascript, Flutter, C#, SQL…"
19,Mobile Application Developer (Flutter),GME Technical Services Sdn Bhd,"RM 3,000 - RM 5,000 a month","Participate in deployment of system including user requirement scoping, design, coding, testing and implementation.
Maintain and support the existing system."
20,Flutter Developer,cake experiential communications (asia) sdn bhd,"RM 3,500 - RM 8,000 a month","You should have good experience in building high-performing, scalable, enterprise-grade applications and be able to write clean code and ensure your programs…"
21,Back End Developer,Tele-Temps Sdn Bhd,"RM 3,000 - RM 3,499 a month","Skills Requirements Compulsory skills: PHP (At least completed 3 projects and above), Laravel Framework, GIT, HTML, HTML5, CSS3, JavaScript, MYSQL."
22,Backend Developer,Esyms Sdn. Bhd.,"RM 6,000 - RM 7,999 a month","Be involved in the entire product development process from conception, design, coding (back-end code, RESTful APIs, web apps), testing and deployment."
23,Frontend Developer,Esyms Sdn. Bhd.,"RM 6,000 - RM 7,999 a month","Build reusable code and libraries for various projects.
Collaborate with other developers, designers, and architects to meet application requirements and…"
24,Flutter Mobile App Developer,BestWeb Technologies Sdn Bhd,"RM 2,500 - RM 5,000 a month","Develop flutter application using Dart (Required).
Integrate mobile applications with backend RESTful services.
Work with outside data sources and APIs."
25,"Senior Software Engineer, Flutter",Bjak Sdn Bhd,"RM 8,000 - RM 20,000 a month","Bjak is focused on providing access to affordable and sustainable financial services for people in ASEAN.
Incorporate user feedback to improve software design…"
26,Flutter Developer,Hays,"RM 8,000 a month","In this team, you will be working closely with the developers, Project Managers, Solution Architect and other members of the project team."
27,IT Support Engineer,Ninja Van,,"Maintain and proactively improve the IT infrastructure of the company to avoid disruptions to operations.
Support and administer third party software and SaaS…"
28,3D/Web GL Developer,Brandt International Sdn Bhd,"RM 7,000 a month","Design to scale from phones to tablets to desktop monitors.
Create AI-powered interactive 3D assets using WebGL, three.js or new web 3d framework/library."
29,Customer Support,Ejen2u International Sdn Bhd,"RM 2,000 - RM 3,700 a month","Knowing some php, mysql, flutter and/or laravel is a plus.
Troubleshoot and respond to client based on the ticket assigned.
In house IT support issue."
30,Full time Developer/Programmer,CARE Concierge,,"Must know Flutter/Dart 2.0.
Understand how BLoC State Management works in Flutter Framework.
Experience deploying Flutter Apps to Google Playstore & Apple…"
31,Senior Software Engineer (Flutter),AirAsia,"RM 8,500 - RM 15,000 a month","Create multi-platform apps for iOS/Android using Flutter Development Framework.
Micro code enhancements within mobile platforms like android/iOS Flutter widgets…"
32,Junior/Senior Flutter Mobile Developer,vimigo,"RM 3,000 - RM 9,000 a month","Free flow snacks, biscuits, coffee, beverages and soft drinks.
Responsible for design, development, maintenance and enhancements of the in-house and customer…"
33,Software Developer,Agensi Pekerjaan Peoplex Human Capital Sdn Bhd,"RM 3,000 - RM 3,499 a month","Job Description - Design, develop and maintain applications on mobile platforms.
Develop new user-facing features using ."
34,Mobile Flutter Developer (Flexible Hours),Hiredly X,"RM 6,000 - RM 12,000 a month","You will be creating and enhancing new features of existing and upcoming projects.
You will be continuously developing intuitive code with the latest Flutter…"
35,Junior/ Senior Software Engineer,DANAPURI SDN BHD,"RM 5,000 - RM 5,999 a month","Utilise best practices and design patterns to write clean, efficient, and elegant code.
Troubleshooting, debugging and resolving technical issues."
36,Mobile Apps Developer (Flutter),SOFAX SDN BHD,"RM 5,000 - RM 8,000 a month","Responsible in creating and enhance new features of existing and upcoming project.
Work closely with the project team for in-house application."
37,INTERNSHIP - SOFTWARE / SYSTEM ANALYST,Sigma Rectrix Systems (M) Sdn Bhd,,Software research and development for Enterprise Resource Planning (ERP) in mobile applications system built using the latest open-source technologies.
38,Senior Android Developer(China Market),Myhrsource Sdn Bhd,"RM 22,500 - RM 29,000 a month","According to business needs, develop programs based on the Android platform;
Able to complete key technology verification and model selection;"
39,Web Developer,BBCSB,"RM 4,000 - RM 8,000 a month","Bachelor’s degree in computer programming, computer science, or related field, or equivalent practical experience for at least 3 years."
40,Software Engineer/ Developer,IME Group of Companies,"RM 2,800 a month",Carry out software programming and coding for Enterprise/Business Solutions according to specifications within specified timeline.
41,iOS/Android Developer,HEXA INITIATIVE SDN BHD,"RM 4,000 - RM 4,999 a month","Handle maintenance of mobile apps such as bug fixes and version updates.
Ensure work delivered in timely manner • Effective and work quickly with team members…"
42,Mobile Apps Developer (Full-stack),Mysuri Biz Technologies Sdn Bhd,,Stack : HTML CSS JavaScript jQuery - Understands Repository Design Pattern - Able to write fully-functional API codes - Good to have basic knowledge in back-end…
43,Programmer,Brighten Business Consulting Sdn Bhd,"RM 3,000 - RM 8,000 a month","Developing and managing well-functioning databases and applications.
Developing front-end website architecture with appealing visual design."
44,Mobile Developer,Sophic Automation,"RM 2,500 - RM 2,999 a month","Develop application programming interfaces (APIs) to support mobile functionality.
Develop mobile application by studying information needs, conferring with…"
45,IT Support (Junior/Mid),Lapasar.com,"RM 3,000 - RM 3,499 a month",To provide application support and enhancement for applications in the company - To identify end user problems and its solutions - To perform enhancement and…
46,Mobile Application Developer (iOS & Android),ACD Development Sdn. Bhd,"RM 4,000 - RM 4,999 a month","Within defined quality and performance standards.
Participate throughout the SDLC, including analysis, design, development, testing, integration, deployment and…"
47,Mobile Application Developer (iOS & Android),BEEDUCATION ADVENTURES SDN BHD,"RM 4,000 - RM 4,999 a month","Within defined quality and performance standards.
Participate throughout the SDLC, including analysis, design, development, testing, integration, deployment and…"
48,Full Stack Developer,Brandt International Sdn Bhd,"RM 7,000 a month","Design and implement responsive web & mobile applications from front to back using popular open source frameworks like MEAN, Ionic and Swagger."
49,Mobile Developer,Techtiera,"RM 2,873 - RM 10,161 a month",We’re looking for creative and dynamic teammates to join us building high performing mobile applications on Android and iOS using latest mobile development…
50,Full-Stack Developer,AFIC Solutions,"RM 3,000 - RM 8,000 a month","Mobile: *Flutter, BLOC, Micro-service implementation.
Database: *SQL (Microsoft SQL Server / MySQL Server);
Good knowledge of Relational Databases."
51,UI/UX Designer + Developer,Brandt International Sdn Bhd,"RM 7,000 a month","Design to scale from phones to tablets to desktop monitors.
Create wireframes, mockups and prototypes for our analytic product."
52,Full Stack Programmer,BCDE Digital Limited,"RM 3,000 - RM 7,500 a month","Developing and managing well-functioning databases and applications.
Developing front-end website architecture with appealing visual design."
53,Flutter Mobile Developer,Randstad,"RM 4,000 - RM 10,000 a month","Participate in the deployment of system including user requirement scoping, design, coding, testing, and implementation."
54,SENIOR MOBILE APPLICATION DEVELOPER,DATADOT SOFTWARE SOLUTIONS SDN. BHD.,"RM 8,000 - RM 9,999 a month","ROLES AND RESPONSIBILITIES • Design and build Hybrid applications using Ionic Framework • Collaborate with cross-functional teams to define, design, and build…"
55,Mobile Application Developer (Flutter),EPS Malaysia,"RM 4,000 - RM 6,000 a month","Design and build sophisicated and highly scalable apps using Flutter.
Support the entire application lifestyle (concept, design, test, release and support)."
56,Web Programmer,La La La Wine & Marketing,"RM 4,000 - RM 8,500 a month","Developing front-end website architecture with appealing visual design.
Developing and managing well-functioning databases and applications."
57,Software Developer,PM101 Consulting,"RM 4,000 - RM 7,000 a month","Assists project manager to ensure that project is delivered within the set budget and timeline.
Maintain good relationship and rapport with client at all times."
58,Web Programmer (Malaysian),BCDE Digital Limited,"RM 3,000 - RM 8,500 a month","Developing and managing well-functioning databases and applications.
Developing front-end website architecture with appealing visual design."
59,Assistant Project Manager ( Software Development),E-INFOMEDIA SOLUTIONS SDN BHD,"RM 6,000 - RM 7,999 a month",Role & Responsibilities • Assists project manager to ensure that project is delivered within the set budget and timeline • Maintain good relationship and…
60,Jr. Software Developer,Fastrexs (M) Sdn Bhd,,Identifying areas for modification in existing codes & subsequently developing these modifications -maintaining & upgrading existing systems -work closely with…
61,Mobile Application Lead,IDC Tech,"RM 15,000 a month","Mobile application lead role is to participate in full dev cycle of mobile application (native and hybrid).
Be the subject matter expert of the applications."
62,Mobile App Developer,Original Intelligence Sdn Bhd,"RM 4,000 - RM 6,000 a month","Develop, maintain, enhance and test mobile applications.
Maintain companyʼs IT infrastructure.
Provide technical support for software, hardware and network…"
63,Junior Software Engineer,GigWorld Inc,"RM 3,000 - RM 4,500 a month","Build and maintain Web Applications.
Build and maintain Mobile Applications.
Setup necessary automation test software technologies."
64,Senior Developer - 1513902,HCL TECHNOLOGIES MALAYSIA SDN. BHD.,"RM 13,000 - RM 15,999 a year",Requirements • Should have overall 5 to 7 years of experience of which at least 5+ years should have been as full stack developer.
65,Graduate Trainee - Mobile Application Developer,Agmo Studio Sdn Bhd,"RM 2,800 - RM 3,200 a month","Collaborate with cross-functional teams to design and develop mobile application.
Integrate with REST JSON API.
Post production monitoring and support."
66,Lead – Mobile App Developer,Ultranet Technologies Sdn Bhd,"RM 5,000 - RM 10,000 a month","Lead and guide mobile app development team.
Participate in business requirements gathering and business re-engineering to ensure proper solutions provided."
67,Software Developer,RAPTOR MALAYSIA SDN BHD,"RM 8,000 - RM 9,999 a month","Develop and maintain various functional, high performance front-end components • develop flutter applications(mobile and web) and integrate with internal and…"
68,Lead – Technology Operations and Digital,Techcom Solutions Pte Ltd,,"The incumbent is responsible to assist the Lead – Technology Operations and Digital on planning, coordination and execution of all tasks and support required to…"
69,SOFTWARE DEVELOPMENT ENGINEER,Aizach Niaga Sdn Bhd,"RM 1,600 - RM 2,500 a month","Experience mobile development framework such as flutter or ionic.
Degree in Software / Computer Science.
Understanding Flowchart of the System."
70,System Analyst / Analyst Programmer,Subur Tiasa Holdings Berhad,,"Job Requirements: - Bachelor Degree / Diploma in Computer Science / Software Engineering / Information Technology.
Experience in web / mobile app development."
71,INTERNSHIP- Websites and Apps Developer for Islamic projects,AQ Wise Sdn Bhd,,"Education = Currently pursuing a Diploma or Bachelor's in IT/Programming/Software Engineering or other related fields.
Job Types: Full-time, Internship."
72,Solution Architect,atQuest Solutions,,The Solution Architect role is responsible to develop the solution blueprint and implement systems architecture with the best possible technologies to meet the…
73,Mobile Developer,Techtiera Sdn Bhd,"RM 2,873 - RM 10,161 a month","High performing mobile applications on Android and iOS using latest.
Mobile development framework by Google.
The development involves creating engaging mobile…"
74,Software Development Internship (Puchong or Ipoh),Alpha Red Solutions Sdn Bhd,RM 500 - RM 800 a month,Full cycle of SDLC -|- Candidate must possess or currently pursuing a Bachelor's Degree in Computer Science/Information Technology or equivalent.
75,Fullstack Developer,V.Net Computer Services,,"Benefits (Employer-paid health and dental insurance, medical benefits, performance & project bonus, paid holidays and time off, etc.)."
76,Lead – Mobile App Developer,Applify Technologies Sdn Bhd,"RM 5,000 - RM 10,000 a month","Provide technical guidance and lead/develop team members.
Extensive knowledge of mobile app front-end UX/UI features, functionalities, programming logic, flow,…"
77,Mobile App Developer,Marvel Media Sdn Bhd,,"Take ownership of the entire application lifecycle (concept, design, test, release and support).
Continuously research, evaluate and adapt new mobile…"
78,Software Engineer / Developer,Ejen2u International Sdn Bhd,"RM 2,200 - RM 5,000 a month","Bachelor’s degree / Diploma / Certificate in computer science, engineering, or a related field• One to three years of experience in software development are…"
79,.NET Developer,AFIC Solutions,"RM 3,000 - RM 8,000 a month","Mobile* : Flutter, BLOC, Micro-service implementation.
Database* : SQL (Microsoft SQL Server / MySQL Server); Excellent knowledge of Relational Databases."
80,DevSecOps Engineer (Software Engineering),iFast Capital,,The Software Engineering team aims to optimize the software development and engineering process to improve the engineering productivity and product quality.
81,Senior Full Stack Developer,Lapasar.com,"RM 6,000 - RM 10,000 a month",You will be working with other (junior-senior) in building and maintaining current and future web/mobile applications.
82,"Mobile App Developer, Android",C SPEED NETWORK TECHNOLOGY SDN. BHD.,,"Participate in deployment of system including user requirement scoping, design, coding, testing and implementation.
Maintain and support existing system."
83,Mobile App Developer,QuickDesk Sdn Bhd,"RM 3,000 - RM 6,000 a month","You will be working on our mobile applications (iOS and/or Android);
Develop user-facing features for the mobile applications;"
84,Assistant Project Manager,InfoDrive Solutions Sdn. Bhd.,"RM 10,000 a month","Contract to Hire Position (1 Year with Infodrive Solutions and after Permanent with client)*.
Assists project manager to ensure that project is delivered within…"
85,Frontend Engineer,EPS Malaysia,,"Design & prototyping highly innovative and intuitive user-facing web and mobile applications.
Develop and integrate cross platform mobile application."
86,Mobile App Developer,Cloone Corporation,"RM 2,500 - RM 6,000 a month","Work closely with customers, analysts, and team members to understand business requirements that drive the analysis and design of quality technical solutions."
87,INFORMATION SYSTEM EXCUTIVE,HMN NADHIR SDN. BHD.,,"Candidates must possess Degree in Software Engineering, Information Technology or any qualification in programming.
CGPA of 3.0 and above."
88,Technical Developer,Rizing,"RM 4,000 - RM 5,000 a month","Versatile software/web developers with less than 2 years’ experience who has worked on popular frontend frameworks/languages namely Kotlin, Flutter, React.js,…"
89,Junior & Senior Software Developer / Engineer,SECURE365 NEXTGEN SOLUTIONS SDN BHD,"RM 2,800 - RM 7,000 a month","Work closely with the technical lead in collecting and documenting user's requirements, development of user stories, timeline and effort estimation."
90,Mobile App Developer (Puchong or Ipoh),Alpha Red Solutions Sdn Bhd,"RM 2,500 - RM 4,500 a month","Responsible for iOS and/or Android application development either in native or cross-platform.
Responsible for mobile application framework design and…"
91,Fullstack developer,Cargo Move,"RM 3,800 - RM 5,000 a month","Work with development teams and product managers to ideate software solutions.
Design client-side and server-side architecture."
92,Software Engineer,Auronex Sdn Bhd,"RM 3,000 - RM 8,000 a month","You’re data-driven and comfortable with basic statistical principles.
NodeJS (ExpressJS) / Python(DJango) / Go / Flutter."
93,MOBILE DEVELOPER,Unixus Solutions,,"Implement and maintain our mobile applications.
Designing and consuming APIs in mobile applications.
Design client & server (mobile) application structure and…"
94,Senior Mobile Developer - Flutter,Michael Page,,"Participate in Digital Transformation projects.
My clients are looking to hire a team of senior mobile developers, mainly focused on Flutter coding."
95,Fullstack Devops,Avaelon Technologies Sdn. Bhd.,RM 500 a week,"Quick development skills being applied at rapid development and engineering -|- well, Python, Java, C, C++ , C# , Laravel, php , html, DB both local environment…"
96,Front End Developer,Versa Asia,"RM 6,000 - RM 16,000 a month",We are looking for a strong front end mobile and web app developer who welcomes both engineering and maintenance tasks.
97,PHP Programmer,Tornado Internet Sdn Bhd,"RM 2,200 - RM 6,000 a month","And from ""Toe"" to ""Head"" to manage.
Required language(s): English and Mandarin(must be able to read,write and speak Mandarin)."
98,Fullstack Developer,CareerMaster Sdn Bhd,"RM 6,000 a month","Responsible for building world-class applications together with our highly collaborative teams.
Design, develop and manage the company Java-based applications."
99,Full Stack Developer,EPS Malaysia,,"Design and develop client-side and server-side architecture for web and mobile applications.
Design and develop effective APIs."
100,Junior/Senior Developer,EPS Malaysia,,"Develop, maintain, enhance and test mobile applications.
Provide technical support for software, hardware and network issues.
0-1 years of experience."
101,Mobile App Developer,TillJannah Sdn. Bhd.,"RM 2,000 - RM 6,000 a month","Must possess at least 3 years of experience in developing mobile app, either Android or iOS.
Good communication skills in Bahasa Melayu and English."
102,Android Developer,SCIKEY,,"To this end, the Android Developer's Responsibilities include writing and proofreading code, liaising with coworkers within and outside of their department, and…"
103,Lead Solution Architect – Mobile,HILTI,,Prepare an architecture vision for a sustainable and modular B2B Mega app (think of the scale of the Amazon shopping app or Uber or Grab apps as a benchmark)…
104,iOS Mobile App Developer,Ingenious Lab Sdn Bhd,"RM 3,000 - RM 4,900 a month","In addition to developing new applications, the role is also responsible for maintenance and providing assistance in the mobile space."
105,Senior Staff Software Engineer,Motorola Solutions,,"We develop Android Software for two way radio communication products.
We architect, design, build and customize the Android Platform to enable value creation to…"
106,IOS Developer,Capgemini Services Malaysia Sdn Bhd,,"You should have a strong knowledge of iOS frameworks and proficiency in Objective-C.
If you have knowledge of iOS patterns and practices and are passionate…"
107,Software Developer (Frontend),SCIKEY,,"Valid for application before Aug 31, 2021 12:08 PM.
Manage the development of software programs and IT systems according to detailed."
108,Senior Engineer/Engineer R&D,Carsome,,"The Senior R&D Engineer will focus more on exploring new technologies, framework, or platform for upcoming projects."
109,Software Developer,SCIKEY,,"Valid for application before Aug 31, 2021 12:08 PM.
Delivery & Execution capability, within the IT Operating Model.
Mobile Hybrid frameworks – GOOD TO HAVE."
110,Senior App Developer,AccVen Sdn Bhd,"RM 5,000 - RM 8,000 a month","Develop new and complete modules, and then enhance existing modules of existing product architecture.
Fully execute user testing on the modules."
111,Software Engineer (Android),AP ExecSearch SDN BHD,"RM 8,000 - RM 10,000 a month","Outlining and executing innovative architecture for Android mobile application.
Demonstrate knowledge & skills in mobile application architecture principles,…"
112,Software Engineer / Web Developer,EasyStore,"RM 4,000 - RM 8,000 a month","Manage codes in multiple server environment.
Optimize codes for high volume transaction.
Love to solve problems with coding."
113,Premier Relationship Manager,TechBridge Market,,The Customer Success Engineer will be responsible for delivering high quality consultation and support services on E2open's Supply Chain applications to meet…
114,Android Software Engineer,EPS Malaysia,,"Work on defining and implementing next generation, innovative architecture for Android mobile application.
Apply state of the art automated testing practices …"
115,"Lead, QA",Career Channel,,"Serves as the QA Team Lead, responsible for Test Automation.
Lead approximately 4 QA, negotiate scope, develop estimates, plans, monitoring metrics, and provide…"
