,title,company,location,salary,description
0,Software Developer Team Lead (Mobile Application),MYFIRST TECH SDN BHD,Johor Bahru•Temporarily Remote,"RM 8,000 - RM 15,000 a month","We develop various Kids tech products.
This position is the Software Lead to manage a team to develop and maintain the mobile application, server application…"
1,Mobile Application Developer - Behavioral Health,Empathic,Kuala Lumpur•Remote,"RM 4,000 - RM 5,000 a month","Support the entire application lifecycle (concept, design, test, release and support).
Produce fully functional mobile applications writing clean code."
2,Mobile Software Engineer (Android) - Leading Technology MNC,Michael Page,Malaysia,,"Global MNC with flexible and dynamic culture.
Apply next level mobile engineering practices.
Ensure the integration between propriety and 3rd party hardware…"
3,MOBILE DEVELOPER,The eCEOS Sdn Bhd,Kuala Lumpur,"RM 6,000 - RM 9,000 a month","A Mobile developer who is able to do application coding, testing, debugging, documenting and monitoring.
As part of agile team, involvement also includes user…"
4,Mobile Application Developer - Behavioral Health,Empathic,Kuala Lumpur•Remote,"RM 4,000 - RM 5,000 a month","Support the entire application lifecycle (concept, design, test, release and support).
Produce fully functional mobile applications writing clean code."
5,Flutter Developer,Brandt International Sdn Bhd,Kuala Lumpur,"RM 6,000 a month",Develop state of the art highly interactive and rich animation experience for mobile and desktop app using Flutter.
6,Flutter Mobile Engineer,Techtiera,Kuala Lumpur,"RM 2,977 - RM 10,358 a month","Build new and key features for Setel on our Flutter codebase by working closely with the Product Managers, design teams and backend team."
7,Web Front-End / Mobile Application Developer (Flutter),atQuest Solutions,Kuala Lumpur,,"Creates next generation mobile application for iOS and Android devices.
Responsible for the development, testing, release and support of the application’s…"
8,Mobile App Developer,QuickDesk,Malaysia,,"You will be working on our mobile applications (iOS and/or Android);
Develop user-facing features for the mobile applications;"
9,IT Application Developer,DreamHunters,Kuala Lumpur•Remote,"RM 800 - RM 1,300 a month","Familiar with Flutter and Laravel.
Diploma/Bachelor’s Degree in I.T. or similar field of study.
Familiar with Flutter and Laravel."
10,Full Time Back End Developer,Startups,Malaysia,,"Php | laravel | mysql | css | html | html5.
Providing full range digital services (online marketing, web hosting, mobile application development, web…"
11,Mobile Developer (Flutter),Hays,Malaysia,,"You will be working with a team to develop and maintain high quality mobile applications.
You will design, develop, and improvise mobile applications using…"
12,Internship for Front End Developer,Startups,Malaysia,,"Bonus : Familiar with frontend framework like vuejs, flutter, reactjs, reactnative etc.
Good at HTML,PHP,CSS ,JavaScript and MySQL."
13,Software Developer,MAXUNITY TECHNOLOGY SDN BHD,Puchong,"RM 3,000 - RM 5,000 a month","Candidate must possess at least Diploma/Advanced/Higher/Graduate Diploma, Bachelor's Degree/Post-Graduate Diploma/Professional Degree in Engineering (Computer…"
14,Application Developer - RS,Plaza Premium Group,Kuala Lumpur,"RM 6,000 - RM 8,000 a month","Develop native Android mobile applications and web applications.
Work closely with developers, testers and business analyst to ensure deliverables are up to…"
15,Software Developer Mobile App Intern,DeltaFrontier,Kuala Lumpur•Temporarily Remote,RM 600 - RM 750 a month,"Design and build Android and iOS mobile applications.
Work closely with design, product management, and development teams to analyse, design, and ship new…"
16,Mobile App Developer,Marvel Media Sdn Bhd,Jelutong,,"Take ownership of the entire application lifecycle (concept, design, test, release and support).
Continuously research, evaluate and adapt new mobile…"
17,Flutter Developer,Hays,Malaysia,"RM 8,000 a month","In this team, you will be working closely with the developers, Project Managers, Solution Architect and other members of the project team."
18,Junior/Senior Software Tester,vimigo,Kuala Lumpur•Temporarily Remote,"RM 3,000 - RM 6,000 a month","As a Unit Software Tester, you will play an instrumental role in fueling Company’s growth through providing timely solutions to execute all levels of testing …"
19,Android Developer 1,Sicpa,Malaysia,,"Work on defining and implementing nextWork on defining and implementing next-generation, innovative architecture for Android mobile application."
20,"Software Engineer, Frontend",Yara,Kuala Lumpur,,"Smallholder regions are characterized by low living standards, high rates of illiteracy and low agricultural productivity."
21,Software Developer,Pingspace Sdn. Bhd.,Bayan Lepas•Temporarily Remote,"RM 3,500 a month","Our Software Developers work on a range of problems: from the backend (designing database, designing operation optimization algorithms, designing communication…"
22,Junior Software Engineer,RedSquare Technologies Sdn Bhd,Kuala Lumpur•Remote,"RM 3,500 - RM 5,001 a month","Mobile applications: Java, Kotlin, Swift, JavaScript (React Native), Dart (Flutter).
Degree in Computer Science or Information Technology or any similar…"
23,IT Support Engineer,Ninja Van,Shah Alam,,"Maintain and proactively improve the IT infrastructure of the company to avoid disruptions to operations.
Support and administer third party software and SaaS…"
24,Software Developer,WELORY INNOVATION SDN BHD,Kota Damansara•Remote,"RM 2,500 - RM 3,500 a month","Develop, enhance and test customised software and mobile apps to meet the requirements.
Participates in the entire software development cycle."
25,Mobile App Developer (Objective C/Swift),Agensi Pekerjaan EPS Consultants Sdn Bhd,Selangor,"RM 5,500 a month","Season Basement parking, Medical Insurance, Annual Bonus, Quarterly Incentive.
Funclub - Overseas Company Trip, Birthday Party, sports and other activities."
26,Junior/Senior Backend Developer,vimigo,Kuala Lumpur•Temporarily Remote,"RM 3,000 - RM 7,000 a month","We are looking for experienced talents in the area of web platforms, web architectures, coding standard, databases, AI technology and mobile apps."
27,3D/Web GL Developer,Brandt International Sdn Bhd,Kuala Lumpur,"RM 7,000 a month","Design to scale from phones to tablets to desktop monitors.
Create AI-powered interactive 3D assets using WebGL, three.js or new web 3d framework/library."
28,Mobile Apps Developer (Flutter or Cordova),LCP Buildsoft Technology (M) Sdn Bhd,Klang,"RM 3,000 - RM 8,000 a month","Design, develop, integrate third-party components, test, install, and support.
Build new product features on server and client side."
29,Mobile App Developer Intern,Tinkerve LLP,Kuala Lumpur,RM 500 - RM 800 a week,"The role works collaboratively with Business Analysts, Backend developers and release management to develop new and exciting mobile applications."
30,Graduate Trainee - Mobile Application Developer,Agmo Studio Sdn Bhd,Kota Damansara,"RM 2,800 - RM 3,200 a month","Collaborate with cross-functional teams to design and develop mobile application.
Integrate with REST JSON API.
Post production monitoring and support."
31,Full Stack Developer,IMT Tech Sdn Bhd,Kuala Lumpur,"RM 6,000 - RM 8,000 a month","Have experience working with 1 PHP MVC framework like Laravel, Yii, CI and willing to convert to Laravel.
Have experience and passion for Front-end Development…"
32,Mobile Application Developer,Innovatz Solutions Sdn. Bhd,Subang Jaya,"RM 10,765 - RM 12,500 a month","Develop mobile applications using React Native framework/Expo.
Participate in the entire product’s lifecycle (analyze, develop, test, release, support)."
33,Software Developer,WELORY INNOVATION SDN BHD,Kota Damansara•Remote,"RM 2,500 - RM 3,500 a month","Develop, enhance and test customised software and mobile apps to meet the requirements.
Participates in the entire software development cycle."
34,Mobile App Developer,QuickDesk,Malaysia,,"You will be working on our mobile applications (iOS and/or Android);
Develop user-facing features for the mobile applications;"
35,Account Executive (Digital Media Project),Nuren Group,Malaysia,,"You will play the account management role in handling our advertiser's digital media projects & campaigns.
You are responsible for managing the flow of work for…"
36,Software Developer (Android),JP CALIBER SDN BHD,Kuala Lumpur,,"Design and build advanced applications for the Android platform.
Collaborate with cross-functional teams to define, design, and ship new features."
37,Senior Frontend Developer,vimigo Technologies,Kuala Lumpur•Temporarily Remote,"RM 4,000 - RM 8,000 a month","We are looking for experienced talents in the area of web platforms, web architectures, coding standards, databases, AI technology and mobile apps."
38,Python Developer,Coreil Consulting,Kuala Lumpur,"RM 2,800 - RM 3,000 a month","It is also better if the candidate had experience in both web and mobile development.*.
As a developer, you will be responsible for designing and develop Python…"
39,Junior/Senior Backend Developer,vimigo,Kuala Lumpur•Temporarily Remote,"RM 3,000 - RM 7,000 a month","We are looking for experienced talents in the area of web platforms, web architectures, coding standard, databases, AI technology and mobile apps."
40,Junior Software Engineer,GigWorld Inc,Petaling Jaya,"RM 3,000 - RM 4,500 a month","Build and maintain Web Applications.
Build and maintain Mobile Applications.
Setup necessary automation test software technologies."
41,Senior Mobile App Engineer,Skymind Global,George Town,,"Participate in design and developing of mobile user interface in collaboration with UI/UX team and backend team, taking new initiatives, grow technical insight…"
42,Senior Java Developer,AMK Solutions Pvt Ltd,Kuala Lumpur,"RM 9,000 a month","The Developer plays a key role in building and developing software and systems as part of IT Delivery & Execution capability, within The IT Operating Model."
43,Mobile Engineer - Flutter (Remote possible),Glints,Kuala Lumpur•Remote,,"Glints engineers are product-driven, with the customers as the starting point.
We also invest in good developer experience, and set aside time to manage…"
44,Mobile Software Engineer - iOS,Sicpa,Malaysia,,"Work on defining and implementing next-generation, innovative architecture for iOS mobile application.
Apply mobile application architecture principles, such as…"
45,Mobile App Engineer,Agensi Pekerjaan EPS Consultants Sdn Bhd,Penang,,"Participate in design and developing of mobile user interface.
Liaison and collaborate with Technical Architect for front-end architecture."
46,Mobile App Developer (Flutter),SOFAX SDN BHD,Bandar Sunway,"RM 5,000 - RM 8,000 a month","Responsible in creating and enhance new features of existing and upcoming project.
Work closely with the project team for in-house application."
47,Senior Java Developer,AMK Solutions Pvt Ltd,Kuala Lumpur,"RM 9,000 a month","The Developer plays a key role in building and developing software and systems as part of IT Delivery & Execution capability, within The IT Operating Model."
48,Mobile App Developer Intern,Tinkerve LLP,Kuala Lumpur,RM 500 - RM 800 a week,"The role works collaboratively with Business Analysts, Backend developers and release management to develop new and exciting mobile applications."
49,.NET Developer,AFIC Solutions,Kuala Lumpur,"RM 3,000 - RM 8,000 a month","Mobile* : Flutter, BLOC, Micro-service implementation.
Database* : SQL (Microsoft SQL Server / MySQL Server); Excellent knowledge of Relational Databases."
50,Senior Software Engineer,Motorola Solutions,Penang,,And in everyday moments — when a package arrives just in time for the holiday or when a child doesn’t miss the school bus home.
51,Full Stack Web Application Developer,allstaff.com.my,Kedah,"RM 4,000 - RM 5,500 a month","Bachelor's Degree in Computer Science or equivalent.
1 to 3 years of software development experience.
Fresh Graduates are welcome to apply."
52,Senior Android Mobile Developer,Techtiera,Kuala Lumpur,"RM 3,530 - RM 10,414 a month","Play a key role to conduct the whole process of designing, building, testing, and deploying the innovative Android apps within our organization."
53,Mobile Application Developer (Cross Platform),Whip Technology Sdn Bhd,Damansara Utama•Temporarily Remote,"RM 2,200 - RM 2,500 a month","Develop intuitive and user friendly cross platform application for mobile and tablet devices,.
Support entire application lifecycle (concept, design, test,…"
54,Senior Java / Spring Boot Developer,SHENMA CREDIT SDN BHD,Kuala Lumpur,"RM 5,000 - RM 7,000 a month","Be hands-on in analysis, development and bring craftsmanship mindset to deliver software with the highest standard of quality."
55,Full Stack Developer,Brandt International Sdn Bhd,Kuala Lumpur,"RM 7,000 a month","Design and implement responsive web & mobile applications from front to back using popular open source frameworks like MEAN, Ionic and Swagger."
56,Software Developer (Android),JP CALIBER SDN BHD,Kuala Lumpur,,"Design and build advanced applications for the Android platform.
Collaborate with cross-functional teams to define, design, and ship new features."
57,Mobile Developer,Reeracoen Malaysia,Seputeh•Remote,"RM 4,000 - RM 6,000 a month","Specialize in providing High End IoT Solutions specifically IIOT (Industrial Internet of Things) to our clients, enabling them to connect their enterprise…"
58,Full-Stack Developer,AFIC Solutions,Kuala Lumpur,"RM 3,000 - RM 8,000 a month","Mobile: *Flutter, BLOC, Micro-service implementation.
Database: *SQL (Microsoft SQL Server / MySQL Server);
Good knowledge of Relational Databases."
59,Graduate Trainee - Mobile Application Developer,Agmo Studio Sdn Bhd,Kota Damansara,"RM 2,800 - RM 3,200 a month","Collaborate with cross-functional teams to design and develop mobile application.
Integrate with REST JSON API.
Post production monitoring and support."
60,Senior iOS Mobile App Developer,ETCTECH GLOBAL SDN BHD,Kuala Lumpur+1 location•Temporarily Remote,"RM 5,000 - RM 7,000 a month","Responsible for conceptualizing and designing next generation features for iOS application.
Communicate regularly and write clean code."
61,Flutter Mobile Developer,Randstad,Kuala Lumpur,"RM 4,000 - RM 10,000 a month","Participate in the deployment of system including user requirement scoping, design, coding, testing, and implementation."
62,Front-end Developer,Big Corridor Sdn Bhd,Selangor,"RM 4,000 - RM 7,000 a month","Translate designs and mock-ups into front-end code.
Perform integrations between front-end and back-end interfaces.
Resolve bottlenecks, and software bugs."
63,Mobile App Engineer,EPS Malaysia,George Town,,"Participate in design and developing of mobile user interface.
Liaison and collaborate with Technical Architect for front-end architecture."
64,"Hiring for ""Android Application Engineer I""",Quess Corp Limited,Penang,,"Minimum Bachelor's degree in Computer Science or Engineering.
Contribute to developing Public Safety Platform Application on Android using mobile technologies."
65,Mobile Engineer (Android/iOS),Xendit,Kuala Lumpur,,"Xendit provides payment infrastructure across Southeast Asia, with a focus on Indonesia and the Philippines.
Build required tooling or infrastructure to help us…"
66,Associate/Senior Mobile Engineer,Astro,Bukit Jalil,,"The role will build, enhance and monitor mobile apps of ASTRO digital products, in a team that is focused on quality and security of mobile apps."
67,Senior Mobile App Engineer,Skymind Global,George Town,,"Participate in design and developing of mobile user interface in collaboration with UI/UX team and backend team, taking new initiatives, grow technical insight…"
68,Solution Architect,atQuest Solutions,Kuala Lumpur,,The Solution Architect role is responsible to develop the solution blueprint and implement systems architecture with the best possible technologies to meet the…
69,Senior Software Developer,Plus Xnergy Edge Technologies,Kuala Lumpur,,Work in full stack development from micro services architecture which interconnect all services to create an optimum system to building in-house dashboard…
70,Software Engineer,Big Corridor Sdn Bhd,Selangor,"RM 4,000 - RM 7,000 a month","Translate application storyboards and use-cases into functional.
Engineering elegant solutions that solve business problems.
O Web API, Entity Framework on ."
71,Senior iOS Mobile App Developer,Techtiera,Kuala Lumpur,"RM 2,792 - RM 8,986 a month","Responsible for conceptualizing and designing next generation features for iOS application.
Communicate regularly and write clean code."
72,Head of Operations,JaGaApp,Petaling Jaya,"RM 5,000 - RM 9,000 a month","Oversee the operation team to meet business targets and to provide great onboarding experience to our customers.
Excellent oral and written command of English."
73,IT Technician/Officer/Executive,Fitxcapes Sdn. Bhd.,Bandar Sunway,"RM 2,000 - RM 5,000 a month",You will be primarily responsible for designing and developing the back-end of the web application but will also be tasked with integrating front-end components…
74,Full Stack Developer,IMT Tech Sdn Bhd,Kuala Lumpur,"RM 6,000 - RM 8,000 a month","Have experience working with 1 PHP MVC framework like Laravel, Yii, CI and willing to convert to Laravel.
Have experience and passion for Front-end Development…"
75,MOBILE DEVELOPER,Unixus Solutions,Shah Alam,,"Implement and maintain our mobile applications.
Designing and consuming APIs in mobile applications.
Design client & server (mobile) application structure and…"
76,Junior Software Engineer,GigWorld Inc,Petaling Jaya,"RM 3,000 - RM 4,500 a month","Build and maintain Web Applications.
Build and maintain Mobile Applications.
Setup necessary automation test software technologies."
77,Full Stack Web Application Developer,EPS Malaysia,Butterworth,,"Designing user interactions on web pages.
Developing back-end website applications.
Ensuring cross-platform optimization for mobile phones."
78,Mobile App Developer,SENWAVE RETAIL SOLUTIONS SDN BHD,Klang,"RM 3,000 - RM 5,000 a month","Work closely with customers, analysts, and team members to understand business requirements that drive the analysis and design of quality technical solutions."
79,Backend Developer,Fast Hiring Jobs - part of Hiredly team,Bandar Kinrara•Remote,"RM 6,500 - RM 8,500 a month",Work closely with the tech lead and collaborate with the core organisation team in accordance with projects consists of web and mobile apps.
80,PHP Developer,Tele-Temps,Kuala Lumpur,"RM 5,000 - RM 13,000 a month","Have experience working with 1 PHP MVC framework like Laravel, Yii, CI and willing to convert to Laravel.
Have experience and passion for Front-end Development…"
81,Mobile Software Engineer (React Native),Excard Corporation Sdn Bhd,Kedah•Remote,"RM 3,800 - RM 5,000 a month","Design, code and maintain mobile apps, from layout to function and according to a client's specifications.
Continue to innovate and improve our existing mobile…"
82,Front End Developer,Softoya International Sdn Bhd,Teluk Panglima Garang,"RM 2,000 - RM 3,000 a month","Programming : Java / Ajax / Jquery / HTML5 / PHP / Javascript / AngularJS / CSS / Ruby on Rail.
Framework : IONIC, Flutter, React Native, Android Studio, XCode."
83,Senior Software Engineer,AirAsia,Kuala Lumpur,,"The technology center comprises a team of software engineering and technology experts based in Malaysia, Bangalore, and Singapore, who would work to streamline…"
84,Software Engineer Intern,RedSquare Technologies Sdn Bhd,Kuala Lumpur•Remote,"RM 1,200 - RM 1,501 a month","Mobile applications: Java, Kotlin, Swift, JavaScript (React Native), Dart (Flutter).
Degree in Computer Science or Information Technology or any similar…"
85,Senior Software Engineer,FUSIONQB SDN BHD,Bangsar South,"RM 6,500 - RM 12,000 a month","Build prototypes for presentation and demonstration.
Liaise with the senior executives and project sponsors for project requirements and deliverables."
86,Mobile / Web Developer,Plant Cartridge Sdn Bhd,Bandar Sunway,"RM 4,000 - RM 6,000 a month","Bachelor’s Degree / Diploma / Certificate in computer science or any related field.
At least one to three years of solid working experience in Mobile/Web…"
87,Junior iOS Developer,Snappymob,Mid Valley City,"RM 4,000 - RM 6,000 a month","Architect, design, develop, and maintain iOS applications.
Collaborate with the engineering team at large in software design sessions, code reviews, teaching,…"
88,"AVP, Mobile Engineer Lead - iOS",Astro,Bukit Jalil,,"The role will build, enhance and monitor mobile apps of ASTRO digital products , in a team that is focused on quality and security of mobile apps ."
89,Mobile / Web Developer,Plant Cartridge Sdn Bhd,Bandar Sunway,"RM 4,000 - RM 6,000 a month","Bachelor’s Degree / Diploma / Certificate in computer science or any related field.
At least one to three years of solid working experience in Mobile/Web…"
90,Junior/ Senior Front End Developer,vimigo,Kuala Lumpur•Remote,"RM 3,000 - RM 7,000 a month","We are looking for experienced talents in the area of web platforms, web architectures, coding standard, databases, AI technology and mobile apps."
91,Senior Software Engineer,Motorola Solutions,Penang,,And in everyday moments — when a package arrives just in time for the holiday or when a child doesn’t miss the school bus home.
92,Jr/Sr Unit Software Tester,vimigo,Cheras,"RM 800 - RM 1,200 a month","As a Unit Software Tester, you will play an instrumental role in fueling Company’s growth through providing timely solutions to execute all levels of testing …"
93,Full Stack Web Application Developer,EPS Malaysia,Butterworth,,"Designing user interactions on web pages.
Developing back-end website applications.
Ensuring cross-platform optimization for mobile phones."
94,Front End Developer,Softoya International Sdn Bhd,Teluk Panglima Garang,"RM 2,000 - RM 3,000 a month","Programming : Java / Ajax / Jquery / HTML5 / PHP / Javascript / AngularJS / CSS / Ruby on Rail.
Framework : IONIC, Flutter, React Native, Android Studio, XCode."
95,MOBILE DEVELOPER,Unixus Solutions,Shah Alam,,"Implement and maintain our mobile applications.
Designing and consuming APIs in mobile applications.
Design client & server (mobile) application structure and…"
96,Senior Software Engineer,AirAsia,Kuala Lumpur,,"The technology center comprises a team of software engineering and technology experts based in Malaysia, Bangalore, and Singapore, who would work to streamline…"
97,Mid-level / Senior JavaScript Developer,Lava X Technologies,Puchong,"RM 4,000 - RM 8,000 a month",Collaborate with product management to translate product requirements to system-level architecture and high-level design that can be reused across multiple…
98,Fullstack Developer,Fast Hiring Jobs - part of Hiredly team,Bandar Kinrara,"RM 6,500 - RM 8,500 a month","Design and develop our front-end application using ReactJS.
Be involved in the entire product development process from conception, design, coding (back-end code…"
99,Solution Architect,atQuest Solutions,Kuala Lumpur,,The Solution Architect role is responsible to develop the solution blueprint and implement systems architecture with the best possible technologies to meet the…
100,Mobile Developer Lead,Reeracoen Malaysia,Seputeh,"RM 7,000 - RM 10,000 a year","Specialize in providing High End IoT Solutions specifically IIOT (Industrial Internet of Things) to our clients, enabling them to connect their enterprise…"
101,Senior App Developer,AccVen Sdn Bhd,Damansara Utama,"RM 5,000 - RM 8,000 a month","Develop new and complete modules, and then enhance existing modules of existing product architecture.
Fully execute user testing on the modules."
102,Fullstack Developer,V.Net Computer Services,Kuala Lumpur,,"Benefits (Employer-paid health and dental insurance, medical benefits, performance & project bonus, paid holidays and time off, etc.)."
103,Software Developer,SCIKEY,Kuala Lumpur,,"Delivery & Execution capability, within the IT Operating Model.
The Software Developer is expected to manage the software building and system development."
104,Fullstack developer,Cargo Move,Ara Damansara,"RM 3,800 - RM 5,000 a month","Work with development teams and product managers to ideate software solutions.
Design client-side and server-side architecture."
105,Software Developer (Frontend),SCIKEY,Kuala Lumpur,,"Manage the development of software programs and IT systems according to detailed.
Technical specifications using quality processes, tools and methodologies."
106,Junior/ Senior Front End Developer,vimigo,Kuala Lumpur•Remote,"RM 3,000 - RM 7,000 a month","We are looking for experienced talents in the area of web platforms, web architectures, coding standard, databases, AI technology and mobile apps."
107,Full Stack Developer (Senior / Junior position),EasyStore,Puchong,"RM 4,000 - RM 8,000 a month","Collaborating with other designers and developers.
Optimize codes for high volume transaction.
Love to solve problems with coding."
108,Android Developer,SCIKEY,Kuala Lumpur,,"To this end, the Android Developer's Responsibilities include writing and proofreading code, liaising with coworkers within and outside of their department, and…"
109,Fullstack Developer,CareerMaster Sdn Bhd,Kuala Lumpur,"RM 6,000 a month","Responsible for building world-class applications together with our highly collaborative teams.
Design, develop and manage the company Java-based applications."
