,title,company,location,salary,description
109,Jr/Sr Unit Software Tester,vimigo,Cheras,"RM 800 - RM 1,200 a month","As a Unit Software Tester, you will play an instrumental role in fueling Company’s growth through providing timely solutions to execute all levels of testing …"
110,Fullstack Developer,V.Net Computer Services,Kuala Lumpur,,"Benefits (Employer-paid health and dental insurance, medical benefits, performance & project bonus, paid holidays and time off, etc.)."
111,Senior Software Engineer (Mobile Developer),AGENSI PEKERJAAN HUNTERS SEARCH SDN. BHD.,Petaling Jaya,"RM 8,000 - RM 9,999 a month",Position Summary Senior Software Developer (Mobile Application) is part of the Solutions Delivery team to meet the skills and expertise needs in supporting…
112,DevOps Engineer (Software Development & IT Operations) (软件开发...,DD Online Services & Enterprise,Johor Bahru,"RM 3,000 - RM 10,000 a month","Accommodation provided for non-Johorian.
Travel leaves with air ticket allowance.
Annual leave and sick leave.
Ability to speak and write in English fluently."
113,Mobile Apps Developer (IOS/ Android/ Flutter),IY Staffing Group,Klang,"RM 3,000 - RM 5,000 a month","This is a full time permanent position.
Medical Claims, Medical Insurance, Medical Leaves, Annual Leaves, Monthly Allowances, Annual Bonus, Company Trips and…"
114,Front End Software Developer,SECURE365 NEXTGEN SOLUTIONS SDN BHD,Kuala Lumpur,"RM 3,500 - RM 5,500 a month","Work closely with the technical lead in collecting and documenting user's requirements, development of user stories, timeline and effort estimation."
115,PHP Programmer,Tornado Internet Sdn Bhd,Puchong,"RM 2,200 - RM 6,000 a month","We code for something client requested and we only build customization website / apps.
You won't feel bored.
And from ""Toe"" to ""Head"" to manage."
116,Senior iOS Developer,Snappymob,Mid Valley City,"RM 8,000 - RM 10,000 a month","As an Senior iOS develop, you'll be an integral member of a software engineering team that designs and develops world-class iOS applications developed in Swift."
117,Software Engineer,Auronex Sdn Bhd,Klang,"RM 3,000 - RM 8,000 a month","Develop different system to solve critical business problem; Requirements: - What do we care about?
You are excited when faced with a task you don’t know how to…"
118,Senior Mobile App Engineer,Skymind Global,George Town,,"This position is for vacancies in SKYMIND CNS SDN BHD (A company of Skymind).
Job Description for Senior Mobile App Engineer:"
119,Support Engineer I 5 days week I Up to SGD3000,Agensi Pekerjaan Nala Sdn Bhd,Johor Bahru,,"Experience in collaboration tools, i.e. Git, Jira, Slack and angular &/or flutter.
Act as the first point of contact for all user support related queries for…"
120,Fullstack Developer,CareerMaster Sdn Bhd,Kuala Lumpur,"RM 6,000 a month","A regional service centre which provides call services, IT applications development, operations and settlements support to the Singapore, Hong Kong, Malaysia…"
121,Senior Software Developer / Engineer,SECURE365 NEXTGEN SOLUTIONS SDN BHD,Kuala Lumpur,"RM 4,000 - RM 6,000 a month","Work closely with the technical lead in collecting and documenting user's requirements, development of user stories, timeline and effort estimation."
122,Software Developer (PHP Full Stack),Enlinea Sdn Bhd,Petaling Jaya,,"JOB RESPONSIBILITIES: - - Work in a team of full stack developers and UI/UX designers.
Develop robust, reliable & high traffic internet application (back-end,…"
123,Fullstack developer,Cargo Move,Ara Damansara,"RM 3,800 - RM 5,000 a month","Work with development teams and product managers to ideate software solutions.
Design client-side and server-side architecture."
124,Fullstack Developer,Fast Hiring Jobs - part of Hiredly team,Bandar Kinrara,"RM 6,500 - RM 8,500 a month","What is your role about?
Design and develop our front-end application using ReactJS.
Be involved in the entire product development process from conception,…"
125,Software Developer,SCIKEY,Kuala Lumpur,,"Date Posted: Feb 09, 2021.
Kuala Lumpur, Kuala Lumpur, Malaysia.
No only open for local candidates.
The Developer plays a key role in building and developing…"
126,Android Mobile Software Engineer,Ingenious Job,Cyberjaya,"RM 7,000 - RM 14,000 a month","BS degree in Computer Science or related field.
Minimum 5 yearsâ€™ experience in mobile development (Android).
Skilled in automated unit and UI testing ."
127,QA Lead (Automation),Agensi Pekerjaan Career Channel Sdn Bhd,Mutiara Damansara•Temporarily Remote,"RM 10,000 - RM 12,000 a month","Serves as the QA Team Lead, responsible for Test Automation.
Lead approximately 4 QA, negotiate scope, develop estimates, plans, monitoring metrics, and provide…"
128,Software Developer (PHP),Enlinea Sdn Bhd,Petaling Jaya,"RM 4,000 - RM 4,999 a month","Job Responsibility: - - Work in a team of full stack developers and UI/UX designers.
Develop robust, reliable & high traffic internet application (back-end,…"
129,IOS Developer,Capgemini Services Malaysia Sdn Bhd,Kuala Lumpur,,"Date Posted: May 10, 2021.
Kuala Lumpur, Kuala Lumpur, Malaysia.
Capgemini Services Malaysia Sdn Bhd.
No only open for local candidates."
130,Software Developer (Frontend),SCIKEY,Kuala Lumpur,,"Manage the development of software programs and IT systems according to detailed.
Technical specifications using quality processes, tools and methodologies."
131,Senior App Developer,AccVen Sdn Bhd,Damansara Utama,"RM 5,000 - RM 8,000 a month","Develop new and complete modules, and then enhance existing modules of existing product architecture.
Fully execute user testing on the modules."
132,Android Developer,SCIKEY,Kuala Lumpur,,"To this end, the Android Developer's Responsibilities include writing and proofreading code, liaising with coworkers within and outside of their department, and…"
133,Software Engineer / Web Developer,EasyStore,Puchong,"RM 4,000 - RM 8,000 a month","Manage codes in multiple server environment.
Optimize codes for high volume transaction.
Love to solve problems with coding."
134,"Mobile Application Developer I 5 days I Up to SGD6,000",Agensi Pekerjaan Nala Sdn Bhd,Johor Bahru,, Familiar with NoSQL and/or cloud database (Cloud Firestore or MongoDB) and experience with flutter Programming language.
135,Senior Android Developer,LCP Buildsoft Technology (M) Sdn Bhd,Klang,"RM 3,500 - RM 7,000 a month","Design, develop, integrate third-party components, test, install, and support.
Build new product features on server and client side."
136,Mid-level / Senior JavaScript Developer,Lava X Technologies,Puchong,"RM 4,000 - RM 8,000 a month",Collaborate with product management to translate product requirements to system-level architecture and high-level design that can be reused across multiple…
137,Software Developer/Programmer,FUSIONQB SDN BHD,Bangsar South,"RM 3,500 - RM 8,000 a month","Build prototypes for presentation and demonstration.
Liaise with the senior executives and project sponsors for project requirements and deliverables."
138,Full Stack JaveScript Developer,ACD Development Sdn. Bhd,Subang Jaya,,"As a Full Stack JavaScript developer, you’ll collaborate with internal teams to develop functional applications, while working in a fast-paced environment."
139,Software Developer (Backend),SCIKEY,Kuala Lumpur,,"Manage the development of software programs and IT systems according to detailed.
Technical specifications using quality processes, tools and methodologies."
140,Senior Engineer/Engineer R&D,Carsome,Petaling Jaya,,"The Senior R&D Engineer will focus more on exploring new technologies, framework, or platform for upcoming projects."
141,Full Stack JavaScript Developer,BEEDUCATION ADVENTURES SDN BHD,Subang Jaya,,"As a Full Stack JavaScript developer, you’ll collaborate with internal teams to develop functional applications, while working in a fast-paced environment."
142,Android Software Engineer,EPS Malaysia,Cyberjaya,,"Work on defining and implementing next generation, innovative architecture for Android mobile application.
Apply state of the art automated testing practices …"
143,"Lead, QA",Career Channel,Petaling Jaya,,"Serves as the QA Team Lead, responsible for Test Automation.
Lead approximately 4 QA, negotiate scope, develop estimates, plans, monitoring metrics, and provide…"
144,Senior Software Engineer,Motorola Solutions,Penang,,And in everyday moments — when a package arrives just in time for the holiday or when a child doesn’t miss the school bus home.
145,Software Developer (Flutter Experience)-Mandarin Speaker Pre...,Two95 International Inc.,Selangor,"RM 3,000 - RM 6,500 a month","Design, implement & manage apps that can scale and serve millions of users.
Design and implement RESTful and GraphQL API."
146,Senior Engineer/Engineer Mobile,Carsome,Petaling Jaya,,"This person will own software quality assurance, working directly with backend developers project leads and software testers."
147,"Senior Engineer, QA",Career Channel,Petaling Jaya,,"QA engineer responsibilities include designing and implementing tests, debugging and defining corrective actions."
148,Ionic Mobile Application Developer (Fulltime),GO CLASS SDN BHD,Kuala Lumpur,"RM 4,000 - RM 5,000 a month","Minimum 2 years experience in Ionic / Flutter or other mobile app development.
Excellent in JavaScript, Typescript, SCSS, and other related languages."
149,Quality Assurance Lead (Automation),Career Channel,Petaling Jaya,,"Serves as the QA Team Lead, responsible for Test Automation.
Lead approximately 4 QA, negotiate scope, develop estimates, plans, monitoring metrics, and provide…"
150,Engineer/Sr. Engineer - Full Stack,Carsome,Petaling Jaya,,You will cooperate with interdisciplinary teams in projects and experience how technology and team spirit unite to create innovative solutions.
151,Lead Engineering,SCIKEY,Petaling Jaya,,"Full Time/Permanent (hiring on behalf).
Utilize a hands-on and adaptable leadership style with a commitment to accountability and driving results."
152,Senior Software Engineer (Frontend),iPrice group,Bangsar South,,"Work in a Booming Sector with Exciting Challenges.
Deliver user stories that crafting front end components using HTML5, CSS3, JavaScript 6, AJAX and PHP."
