,title,company,location,salary,description
110,Android Software Engineer,EPS Malaysia,Cyberjaya,,"Work on defining and implementing next generation, innovative architecture for Android mobile application.
Apply state of the art automated testing practices …"
111,Android Mobile Software Engineer,Ingenious Job,Cyberjaya,"RM 7,000 - RM 14,000 a month","BS degree in Computer Science or related field.
Minimum 5 yearsâ€™ experience in mobile development (Android).
Skilled in automated unit and UI testing ."
112,Mid-level / Senior JavaScript Developer,Lava X Technologies,Puchong,"RM 4,000 - RM 8,000 a month",Collaborate with product management to translate product requirements to system-level architecture and high-level design that can be reused across multiple…
113,Senior App Developer,AccVen Sdn Bhd,Damansara Utama,"RM 5,000 - RM 8,000 a month","Develop new and complete modules, and then enhance existing modules of existing product architecture.
Fully execute user testing on the modules."
114,Software Developer (Backend),SCIKEY,Kuala Lumpur,,"Manage the development of software programs and IT systems according to detailed.
Technical specifications using quality processes, tools and methodologies."
115,Fullstack Developer,Fast Hiring Jobs - part of Hiredly team,Bandar Kinrara,"RM 6,500 - RM 8,500 a month","Design and develop our front-end application using ReactJS.
Be involved in the entire product development process from conception, design, coding (back-end code…"
116,Senior Engineer/Engineer Mobile,Carsome,Petaling Jaya,,"This person will own software quality assurance, working directly with backend developers project leads and software testers."
117,Software Developer/Programmer,FUSIONQB SDN BHD,Bangsar South,"RM 3,500 - RM 8,000 a month","Build prototypes for presentation and demonstration.
Liaise with the senior executives and project sponsors for project requirements and deliverables."
118,Senior Engineer/Engineer R&D,Carsome,Petaling Jaya,,"The Senior R&D Engineer will focus more on exploring new technologies, framework, or platform for upcoming projects."
