,title,company,location,salary,description
0,Snr Flutter Developer,Green Packet International Sdn Bhd,Selangor,,"Job Responsibilities:

Designs, develops, and provides customization of various…"
1,Flutter Developer,Brandt International Sdn Bhd,Kuala Lumpur,"RM 6,000 a month",Develop state of the art highly interactive and rich animation experience for mobile and desktop app using Flutter.
2,Software Developer,MAXUNITY TECHNOLOGY SDN BHD,Puchong,"RM 3,000 - RM 5,000 a month","Candidate must possess at least Diploma/Advanced/Higher/Graduate Diploma, Bachelor's Degree/Post-Graduate Diploma/Professional Degree in Engineering (Computer…"
3,Mobile App Developer,QuickDesk,Malaysia,,"You will be working on our mobile applications (iOS and/or Android);
Develop user-facing features for the mobile applications;"
4,Unity Developer,Hays,Malaysia,"RM 7,000 - RM 10,000 a month","You would be responsible for developing interactive experiences such as Augmented Reality & Virtual Reality, be it on any platform events, kiosks, mobile,…"
5,Wordpress & Mobile App Developer,Advance Plus Property Management Sdn Bhd,Bukit Gelugor,"RM 3,000 - RM 3,499 a month","Job Scopes: - Develop and maintain websites and web-based application with WordPress, WooCommerce & CMS - Designing, integrating, upgrading and maintaining the…"
6,Android Developer 1,Sicpa,Malaysia,,"Work on defining and implementing nextWork on defining and implementing next-generation, innovative architecture for Android mobile application."
7,Software Developer,Pingspace Sdn. Bhd.,Bayan Lepas•Temporarily Remote,"RM 3,500 a month","Our Software Developers work on a range of problems: from the backend (designing database, designing operation optimization algorithms, designing communication…"
8,Internship for Computer IT (Web Programmer),Dideta Multitech Sdn Bhd,Pasir Puteh,"RM 1,200 a month",Testing and de-bugging to make sure our platform runs smoothly Data processing and analysis Exposure to cloud technologies Requirements: Candidate must possess…
9,Flutter Developer,Snaphunt,Kuala Lumpur,,"The OfferOpportunity within an award-winning people development solutions firmBe involved in developing high-impact products Work in a fast-paced, startup…"
10,Mobile Developer (Flutter),Hays,Malaysia,,"You will be working with a team to develop and maintain high quality mobile applications.
You will design, develop, and improvise mobile applications using…"
11,INTERNSHIP-Full time Programmer to develop Websites and Apps,AQ Wise Sdn Bhd,Shah Alam•Remote,,"INTERNSHIP- Full time Programmer to develop Websites and Apps.
Acquire Flutter programming skill or Willing to learn Flutter intensively."
12,Mobile App Developer,Marvel Media Sdn Bhd,Jelutong,,"Take ownership of the entire application lifecycle (concept, design, test, release and support).
Continuously research, evaluate and adapt new mobile…"
13,Software Engineer,Wemabox Solutions Sdn. Bhd.,Ipoh,"RM 3,000 - RM 3,499 a month","Job Description Software Engineer is responsible to design and implement system, feature, and solutions business needs."
14,Junior Full Stack Developer I WFH & Office-Hybrid,AGTIV Consulting Sdn Bhd,Kuala Lumpur•Remote,"RM 3,500 - RM 3,999 a month","Our projects are with some of the largest banks, insurance, oil & gas as well as pharmaceutical companies in Malaysia, Singapore, India, France, and beyond."
15,Software Engineer,Wemabox Solutions Sdn. Bhd.,Ipoh,"RM 3,000 - RM 3,499 a month","Job Description Software Engineer is responsible to design and implement system, feature, and solutions business needs."
16,Internship 2022 - IT/Computer Science/Software Engineering,GNey Software Sdn Bhd,Masai,,View all GNey Software Sdn Bhd jobs - Masai jobsSalary Search: Internship 2022 - IT/Computer Science/Software Engineering salaries
17,Full Stack Web Application Developer,BLUEWARE MALAYSIA SDN BHD,Butterworth,,"Designing user interactions on web pages.
Developing back end website applications.
Creating servers and databases for functionality."
18,Mobile Application Developer,Innovatz Solutions Sdn. Bhd,Subang Jaya,"RM 10,765 - RM 12,500 a month","Develop mobile applications using React Native framework/Expo.
Participate in the entire product’s lifecycle (analyze, develop, test, release, support)."
19,Software Engineer,Motorola Solutions,Penang,,And in everyday moments — when a package arrives just in time for the holiday or when a child doesn’t miss the school bus home.
20,Software Engineer,World Syntecjh Solution Sdn Bhd,Bukit Mertajam,"RM 2,000 - RM 2,499 a month","Responsibilities - Developing, design, testing, and implementation for web and software application project - Develop technical and user documentation."
21,Account Executive (Digital Media Project),Nuren Group,Malaysia,,"You will play the account management role in handling our advertiser's digital media projects & campaigns.
You are responsible for managing the flow of work for…"
22,Senior Java Developer,AMK Solutions Pvt Ltd,Kuala Lumpur,"RM 9,000 a month","The Developer plays a key role in building and developing software and systems as part of IT Delivery & Execution capability, within The IT Operating Model."
23,Flutter Developer,BEEDUCATION ADVENTURES SDN BHD,Subang Jaya,,"Within defined quality and performance standards.
Participate throughout the SDLC, including analysis, design, development, testing, integration, deployment and…"
24,Junior Full Stack Developer I WFH & Office-Hybrid,AGTIV Consulting Sdn Bhd,Kuala Lumpur•Remote,"RM 3,500 - RM 3,999 a month","Our projects are with some of the largest banks, insurance, oil & gas as well as pharmaceutical companies in Malaysia, Singapore, India, France, and beyond."
25,Flutter Developer,ACD Development Sdn. Bhd,Subang Jaya,,"Within defined quality and performance standards.
Participate throughout the SDLC, including analysis, design, development, testing, integration, deployment and…"
26,Associate/Senior Mobile Engineer (Flutter),Astro,Kuala Lumpur,,"The role will build, enhance and monitor mobile apps of ASTRO digital products, in a team that is focused on quality and security of mobile appsWhat you will do…"
27,IT Support Engineer,Ninja Van,Shah Alam,,"Maintain and proactively improve the IT infrastructure of the company to avoid disruptions to operations.
Support and administer third party software and SaaS…"
28,Frontend Engineer,Technerve Technology Solutions Sdn Bhd,Bangi,"RM 3,000 - RM 3,499 a month","Minimum 2 years experience in HTML, CSS, and Javascript.
Good understanding of responsive design and mobile optimized websites."
29,Mobile Apps Developer,Agensi Pekerjaan Career Horizons,Kuala Lumpur•Remote,"RM 10,000 a month","• Transform business requirements into functional mobile apps.
Monitor, optimize and maintain high performance of the application."
30,Mobile Software Engineer - iOS,Sicpa,Malaysia,,"Work on defining and implementing next-generation, innovative architecture for iOS mobile application.
Apply mobile application architecture principles, such as…"
31,Developer Computer Science Intern (6 months),Mysuri Biz Technologies Sdn Bhd,Cyberjaya,"RM 1,200 a week","Stack : HTML CSS JavaScript jQuery - Good to have basic knowledge in back-end framework like laravel / nodejs, but not compulsory - Fresh grad is encouraged to…"
32,Web Front-End / Mobile Application Developer (Flutter),atQuest Solutions,Kuala Lumpur,,"Creates next generation mobile application for iOS and Android devices.
Responsible for the development, testing, release and support of the application’s…"
33,Mobile App Developer,Wemabox Solutions Sdn. Bhd.,Ipoh,"RM 3,000 - RM 3,499 a month","Job Description Mobile App Developer is responsible to design and implement system, feature, and solutions business needs."
34,3D/Web GL Developer,Brandt International Sdn Bhd,Kuala Lumpur,"RM 7,000 a month","Design to scale from phones to tablets to desktop monitors.
Create AI-powered interactive 3D assets using WebGL, three.js or new web 3d framework/library."
35,Mobile Application Developer (Cross Platform),Whip Technology Sdn Bhd,Damansara Utama•Temporarily Remote,"RM 2,200 - RM 2,500 a month","Develop intuitive and user friendly cross platform application for mobile and tablet devices,.
Support entire application lifecycle (concept, design, test,…"
36,Web & Apps Developer,BLUEDALE INTEGRATED (M) SDN. BHD.,Petaling Jaya,,"Responsible for designing, coding and modifying websites, from layout to function.
Strive to create visually appealing sites that feature user-friendly design…"
37,Software Developer (PHP),Nuren Group,Malaysia,,"Work in a team of full stack developers and UI/UX designers.
Develop robust, reliable & high traffic internet application (back-end, front-end, mobile)."
38,"Manager, Operations Solutions",Skylink Pacific Solutions Sdn Bhd,Kuala Lumpur,,Job Responsibilities • Oversee operations solutions’ development and implementation of projects that contribute to the improvement and standardization of the…
39,PHP developer,Agensi Pekerjaan Synopsis Sdn Bnd,Cyberjaya,"RM 4,000 - RM 4,999 a month",Requirements: ✅ Have extensive knowledge in exploring API and UI standards ✅ Familiar with php/laravel framework ✅ Familiar with flutter framework (Added…
40,Full Stack Developer,IMT Tech Sdn Bhd,Kuala Lumpur,"RM 6,000 - RM 8,000 a month","Have experience working with 1 PHP MVC framework like Laravel, Yii, CI and willing to convert to Laravel.
Have experience and passion for Front-end Development…"
41,Software Engineer II,AirAsia,Kuala Lumpur+1 location,,"The technology center comprises a team of software engineering and technology experts based in Malaysia, Bangalore, and Singapore, who would work to streamline…"
42,System Analyst / Analyst Programmer,Subur Tiasa Holdings Berhad,Sibu,,"Job Responsibility:To play a proactive role in deriving system solutions to any given business requirement or problem To design, develop, integrate, test,…"
43,Mobile Developer,Tamarix Onesolutions Sdn Bhd,Cyberjaya,"RM 4,000 - RM 7,000 a month","✅ Familiar with flutter framework (Added Advantage).
✅ Transform business requirement into mobile apps.
✅ Experienced in IOS and Android Developments."
44,Junior/Senior Software Engineer (软件工程师),DD Online Services & Enterprise,Johor Bahru,"RM 3,000 - RM 10,000 a month","Accommodation provided for non-Johorian.
Travel leaves with air ticket allowance.
Annual leave and sick leave.
Develop and deliver features in a timely matter."
45,Web Front-End / Mobile Application Developer (Flutter),atQuest Solutions,Kuala Lumpur,,"Creates next generation mobile application for iOS and Android devices.
Responsible for the development, testing, release and support of the application’s…"
46,Mobile App Developer,Wemabox Solutions Sdn. Bhd.,Ipoh,"RM 3,000 - RM 3,499 a month","Job Description Mobile App Developer is responsible to design and implement system, feature, and solutions business needs."
47,3D/Web GL Developer,Brandt International Sdn Bhd,Kuala Lumpur,"RM 7,000 a month","Design to scale from phones to tablets to desktop monitors.
Create AI-powered interactive 3D assets using WebGL, three.js or new web 3d framework/library."
48,Mobile Application Developer (Cross Platform),Whip Technology Sdn Bhd,Damansara Utama•Temporarily Remote,"RM 2,200 - RM 2,500 a month","Develop intuitive and user friendly cross platform application for mobile and tablet devices,.
Support entire application lifecycle (concept, design, test,…"
49,Web & Apps Developer,BLUEDALE INTEGRATED (M) SDN. BHD.,Petaling Jaya,,"Responsible for designing, coding and modifying websites, from layout to function.
Strive to create visually appealing sites that feature user-friendly design…"
50,Software Developer (PHP),Nuren Group,Malaysia,,"Work in a team of full stack developers and UI/UX designers.
Develop robust, reliable & high traffic internet application (back-end, front-end, mobile)."
51,"Manager, Operations Solutions",Skylink Pacific Solutions Sdn Bhd,Kuala Lumpur,,Job Responsibilities • Oversee operations solutions’ development and implementation of projects that contribute to the improvement and standardization of the…
52,PHP developer,Agensi Pekerjaan Synopsis Sdn Bnd,Cyberjaya,"RM 4,000 - RM 4,999 a month",Requirements: ✅ Have extensive knowledge in exploring API and UI standards ✅ Familiar with php/laravel framework ✅ Familiar with flutter framework (Added…
53,Full Stack Developer,IMT Tech Sdn Bhd,Kuala Lumpur,"RM 6,000 - RM 8,000 a month","Have experience working with 1 PHP MVC framework like Laravel, Yii, CI and willing to convert to Laravel.
Have experience and passion for Front-end Development…"
54,Software Engineer II,AirAsia,Kuala Lumpur+1 location,,"The technology center comprises a team of software engineering and technology experts based in Malaysia, Bangalore, and Singapore, who would work to streamline…"
55,MOBILE DEVELOPER,EBOSS INNOVATION SDN BHD,Petaling Jaya,"RM 3,000 - RM 4,000 a month","*Developing, debugging and supporting* mobile applications (iOS/Android) and their infrastructure.
Be actively involved in *technical design *of the application…"
56,.NET Developer,AFIC Solutions,Kuala Lumpur,"RM 3,000 - RM 8,000 a month","Mobile* : Flutter, BLOC, Micro-service implementation.
Database* : SQL (Microsoft SQL Server / MySQL Server); Excellent knowledge of Relational Databases."
57,Full-Stack Developer,AFIC Solutions,Kuala Lumpur,"RM 3,000 - RM 8,000 a month","Mobile: *Flutter, BLOC, Micro-service implementation.
Database: *SQL (Microsoft SQL Server / MySQL Server);
Good knowledge of Relational Databases."
58,UI/UX Designer + Developer,Brandt International Sdn Bhd,Kuala Lumpur,"RM 7,000 a month","Design to scale from phones to tablets to desktop monitors.
Create wireframes, mockups and prototypes for our analytic product."
59,Customer Support,Ejen2u International Sdn Bhd,Puchong,"RM 2,000 - RM 3,700 a month","Knowing some php, mysql, flutter and/or laravel is a plus.
Troubleshoot and respond to client based on the ticket assigned.
In house IT support issue."
60,Head of Operations,JaGaApp,Petaling Jaya,"RM 5,000 - RM 9,000 a month","Oversee the operation team to meet business targets and to provide great onboarding experience to our customers.
Excellent oral and written command of English."
61,Mobile Application Developer,Nss It Solution Sdh Bhd,Cyberjaya,"RM 6,000 - RM 7,999 a month",Develop mobile Android and iOS applications • Applicant can possess one or more the following skill set: - Develop iOS application using Swift and/or Obj-C -…
62,Front-end Developer,Big Corridor Sdn Bhd,Selangor,"RM 4,000 - RM 7,000 a month","Translate designs and mock-ups into front-end code.
Perform integrations between front-end and back-end interfaces.
Resolve bottlenecks, and software bugs."
63,Quality Assurance Engineer,MHub,Subang Jaya,"RM 5,000 - RM 8,000 a month","As a Quality Assurance Engineer, you will be responsible for creating test cases, covering functional, technical and UI end-to-end tests for all products and…"
64,Software Engineer,Brighten Business Consulting Sdn Bhd,Cheras,"RM 7,000 - RM 10,000 a month","Developing and managing well-functioning databases and applications.
Developing front-end website architecture with appealing visual design."
65,Software Engineer / Web Developer,EasyStore Commerce Sdn Bhd,Puchong•Temporarily Remote,,"Manage codes in multiple server environment.
Optimize codes for high volume transaction.
Research on new technologies (a better and easier way to solve the same…"
66,Fullstack Developer,V.Net Computer Services,Kuala Lumpur,,"Benefits (Employer-paid health and dental insurance, medical benefits, performance & project bonus, paid holidays and time off, etc.)."
67,Full Stack Web Application Developer,allstaff.com.my,Kedah,"RM 4,000 - RM 5,500 a month","Bachelor's Degree in Computer Science or equivalent.
1 to 3 years of software development experience.
Fresh Graduates are welcome to apply."
68,Mobile App Developer Intern,Tinkerve LLP,Kuala Lumpur,RM 500 - RM 800 a week,"The role works collaboratively with Business Analysts, Backend developers and release management to develop new and exciting mobile applications."
69,Senior Mobile App Engineer,SKYMIND HOLDINGS BERHAD,Penang,,Job Description for Senior Mobile App Engineer: - Participate in design and developing of mobile user interface in collaboration with UI/UX team and backend…
70,Senior Mobile App Engineer,SKYMIND HOLDINGS BERHAD,Penang,,Job Description for Senior Mobile App Engineer: - Participate in design and developing of mobile user interface in collaboration with UI/UX team and backend…
71,Backend Developer,Fast Hiring Jobs - part of Hiredly team,Bandar Kinrara•Remote,"RM 6,500 - RM 8,500 a month",Work closely with the tech lead and collaborate with the core organisation team in accordance with projects consists of web and mobile apps.
72,Full Stack Developer,Brandt International Sdn Bhd,Kuala Lumpur,"RM 7,000 a month","Design and implement responsive web & mobile applications from front to back using popular open source frameworks like MEAN, Ionic and Swagger."
73,Mobile Application Developer (Flutter),EPS Malaysia,Kuala Lumpur,"RM 4,000 - RM 6,000 a month","Design and build sophisicated and highly scalable apps using Flutter.
Support the entire application lifestyle (concept, design, test, release and support)."
74,Senior Software Developer,Plus Xnergy,Bukit Jalil,"RM 4,604 - RM 11,276 a month",Work in full stack development from micro services architecture which interconnect all services to create an optimum system to building in-house dashboard…
75,Senior Java / Spring Boot Developer,SHENMA CREDIT SDN BHD,Kuala Lumpur,"RM 5,000 - RM 7,000 a month","Be hands-on in analysis, development and bring craftsmanship mindset to deliver software with the highest standard of quality."
76,Full time Developer/Programmer,Savor of Life,Kuala Lumpur•Temporarily Remote,,"Must know Flutter/Dart 2.0.
Understand how BLoC State Management works in Flutter Framework.
Experience deploying Flutter Apps to Google Playstore & Apple…"
77,Senior Mobile App Engineer,Skymind Global,George Town,,"Participate in design and developing of mobile user interface in collaboration with UI/UX team and backend team, taking new initiatives, grow technical insight…"
78,WEB & APPS DEVELOPER,Bluedale Publishing (M) Sdn Bhd,Petaling Jaya,,"Responsible for designing, coding and modifying websites, from layout to function.
Strive to create visually appealing sites that feature user-friendly design…"
79,Senior Software Engineer,REDtone Telecommunications Sdn Bhd,Puchong,"RM 5,000 - RM 10,000 a month","The Software Engineer is responsible to perform analysis, design and coding of functional requirements specifications of applications."
80,Mobile App Developer,SENWAVE RETAIL SOLUTIONS SDN BHD,Klang,"RM 3,000 - RM 5,000 a month","Work closely with customers, analysts, and team members to understand business requirements that drive the analysis and design of quality technical solutions."
81,Software Engineer,RedSquare Technologies Sdn Bhd,Kuala Lumpur•Remote,"RM 4,000 - RM 5,001 a month","Mobile applications: Java, Kotlin, Swift, JavaScript (React Native), Dart (Flutter).
Degree in Computer Science or Information Technology or any similar…"
82,Solution Architect,atQuest Solutions,Kuala Lumpur,,The Solution Architect role is responsible to develop the solution blueprint and implement systems architecture with the best possible technologies to meet the…
83,Graduate Trainee - Mobile Application Developer,Agmo Studio Sdn Bhd,Kota Damansara,"RM 2,800 - RM 3,200 a month","Collaborate with cross-functional teams to design and develop mobile application.
Integrate with REST JSON API.
Post production monitoring and support."
84,Solutions Consultant (Tech Lead),WorldLine,Kuala Lumpur,,"Guide team debugging efforts (e.g. poor task management, unclear requirements, complex development process, etc)."
85,Support Engineer I 5 days week I Up to SGD3000,Agensi Pekerjaan Nala Sdn Bhd,Johor Bahru,,"Experience in collaboration tools, i.e. Git, Jira, Slack and angular &/or flutter.
Act as the first point of contact for all user support related queries for…"
86,DevOps Engineer (Software Development & IT Operations) (软件开发...,DD Online Services & Enterprise,Johor Bahru,"RM 3,000 - RM 10,000 a month","Accommodation provided for non-Johorian.
Travel leaves with air ticket allowance.
Annual leave and sick leave.
Ability to speak and write in English fluently."
87,"AVP, Mobile Engineer Lead - iOS",Astro,Bukit Jalil,,"The role will build, enhance and monitor mobile apps of ASTRO digital products , in a team that is focused on quality and security of mobile apps ."
88,WEB & APPS DEVELOPER,BLUEDALE MEDIA (M) SDN. BHD.,Petaling Jaya,,"Responsible for designing, coding and modifying websites, from layout to function.
Strive to create visually appealing sites that feature user-friendly design…"
89,Senior Software Engineer,AirAsia,Kuala Lumpur+1 location,,"The technology center comprises a team of software engineering and technology experts based in Malaysia, Bangalore, and Singapore, who would work to streamline…"
90,Associate/Senior Mobile Engineer,Astro,Bukit Jalil,,"The role will build, enhance and monitor mobile apps of ASTRO digital products, in a team that is focused on quality and security of mobile apps."
91,Mobile Apps Developer (Full-stack),Mysuri Biz Technologies Sdn Bhd,Cyberjaya,,Stack : HTML CSS JavaScript jQuery - Understands Repository Design Pattern - Able to write fully-functional API codes - Good to have basic knowledge in back-end…
92,Software Engineer,Big Corridor Sdn Bhd,Selangor,"RM 4,000 - RM 7,000 a month","Translate application storyboards and use-cases into functional.
Engineering elegant solutions that solve business problems.
O Web API, Entity Framework on ."
93,iOS/Android Developer,HEXA INITIATIVE SDN BHD,Petaling Jaya,,"Handle maintenance of mobile apps such as bug fixes and version updates.
Ensure work delivered in timely manner • Effective and work quickly with team members…"
94,Junior Software Engineer,GigWorld Inc,Petaling Jaya,"RM 3,000 - RM 4,500 a month","Build and maintain Web Applications.
Build and maintain Mobile Applications.
Setup necessary automation test software technologies."
95,Front End Developer,Versa Asia,Kuala Lumpur,"RM 6,000 - RM 16,000 a month",We are looking for a strong front end mobile and web app developer who welcomes both engineering and maintenance tasks.
96,Mobile App Developer,QuickDesk Sdn Bhd,Kuala Lumpur,"RM 3,000 - RM 6,000 a month","You will be working on our mobile applications (iOS and/or Android);
Develop user-facing features for the mobile applications;"
97,Frontend Developer,Fast Hiring Jobs - part of Hiredly team,Bandar Kinrara,"RM 6,500 - RM 8,500 a month","Build reusable code and libraries for various projects.
Collaborate with other developers, designers, and architects to meet application requirements and…"
98,Flutter Mobile Developer,Randstad,Kuala Lumpur,"RM 4,000 - RM 10,000 a month","Participate in the deployment of system including user requirement scoping, design, coding, testing, and implementation."
99,Senior iOS Mobile App Developer,ETCTECH GLOBAL SDN BHD,Kuala Lumpur+1 location•Temporarily Remote,"RM 5,000 - RM 7,000 a month","Responsible for conceptualizing and designing next generation features for iOS application.
Communicate regularly and write clean code."
100,Mobile App Developer Intern,Tinkerve LLP,Kuala Lumpur,RM 500 - RM 800 a week,"The role works collaboratively with Business Analysts, Backend developers and release management to develop new and exciting mobile applications."
101,Software Engineer,Brighten Business Consulting Sdn Bhd,Cheras,"RM 7,000 - RM 10,000 a month","Developing and managing well-functioning databases and applications.
Developing front-end website architecture with appealing visual design."
102,Software Engineer / Web Developer,EasyStore Commerce Sdn Bhd,Puchong•Temporarily Remote,,"Manage codes in multiple server environment.
Optimize codes for high volume transaction.
Research on new technologies (a better and easier way to solve the same…"
103,Full time Developer/Programmer,Savor of Life,Kuala Lumpur•Temporarily Remote,,"Must know Flutter/Dart 2.0.
Understand how BLoC State Management works in Flutter Framework.
Experience deploying Flutter Apps to Google Playstore & Apple…"
104,Fullstack Developer,V.Net Computer Services,Kuala Lumpur,,"Benefits (Employer-paid health and dental insurance, medical benefits, performance & project bonus, paid holidays and time off, etc.)."
105,WEB & APPS DEVELOPER,Bluedale Publishing (M) Sdn Bhd,Petaling Jaya,,"Responsible for designing, coding and modifying websites, from layout to function.
Strive to create visually appealing sites that feature user-friendly design…"
106,Senior Mobile App Engineer,Skymind Global,George Town,,"Participate in design and developing of mobile user interface in collaboration with UI/UX team and backend team, taking new initiatives, grow technical insight…"
107,"AVP, Mobile Engineer Lead - iOS",Astro,Bukit Jalil,,"The role will build, enhance and monitor mobile apps of ASTRO digital products , in a team that is focused on quality and security of mobile apps ."
108,Software Engineer,RedSquare Technologies Sdn Bhd,Kuala Lumpur•Remote,"RM 4,000 - RM 5,001 a month","Mobile applications: Java, Kotlin, Swift, JavaScript (React Native), Dart (Flutter).
Degree in Computer Science or Information Technology or any similar…"
109,Senior Software Engineer,REDtone Telecommunications Sdn Bhd,Puchong,"RM 5,000 - RM 10,000 a month","The Software Engineer is responsible to perform analysis, design and coding of functional requirements specifications of applications."
