,title,company,salary,description
0,Mobile Application Developer,Synopsis,"RM 5,000 - RM 7,000 a month","Familiar with flutter framework (Added Advantage).
Transform business requirement into mobile apps.
Develop and maintain mobile application."
1,Software Engineer,Wemabox Solutions Sdn. Bhd.,"RM 3,000 - RM 3,499 a month","Job Description Software Engineer is responsible to design and implement system, feature, and solutions business needs."
2,Internship for Computer IT (Web Programmer),Dideta Multitech Sdn Bhd,"RM 1,200 a month",Testing and de-bugging to make sure our platform runs smoothly Data processing and analysis Exposure to cloud technologies Requirements: Candidate must possess…
3,Flutter Developer,Brandt International Sdn Bhd,"RM 6,000 a month",Develop state of the art highly interactive and rich animation experience for mobile and desktop app using Flutter.
4,Associate/Senior Mobile Engineer (Flutter),Astro Holdings,,"The role will build, enhance and monitor mobile apps of ASTRO digital products, in a team that is focused on quality and security of mobile apps."
5,Flutter Junior Programmer,XEERSOFT SDN BHD,,"Design & implement new app modules based on the product requirements using Flutter framework.
Build reusable code and libraries for future use."
6,Mobile App Developer,QuickDesk,,"You will be working on our mobile applications (iOS and/or Android);
Develop user-facing features for the mobile applications;"
7,Mobile App Developer,Wemabox Solutions Sdn. Bhd.,"RM 3,000 - RM 3,499 a month","Job Description Mobile App Developer is responsible to design and implement system, feature, and solutions business needs."
8,Mobile App Developer (PJ area/Up to 6k/MS SQL),Agensi Pekerjaan Times Management Consultancy Sdn...,"RM 3,000 - RM 6,000 a month","Developing customized solutions for the mobile platform.
Designing, coding, and implementing mobile applications.
Stay up-to-date with new technology trends."
9,Software Developer,MAXUNITY TECHNOLOGY SDN BHD,"RM 2,800 - RM 3,000 a month","Candidate must possess at least Diploma/Advanced/Higher/Graduate Diploma, Bachelor's Degree/Post-Graduate Diploma/Professional Degree in Engineering (Computer…"
10,Mobile Developer,Tamarix Onesolutions Sdn Bhd,"RM 4,000 - RM 7,000 a month","✅ Familiar with flutter framework (Added Advantage).
✅ Transform business requirement into mobile apps.
✅ Experienced in IOS and Android Developments."
11,Flutter Developer,BEEDUCATION ADVENTURES SDN BHD,,"Within defined quality and performance standards.
Participate throughout the SDLC, including analysis, design, development, testing, integration, deployment and…"
12,Wordpress & Mobile App Developer,Advance Plus Property Management Sdn Bhd,"RM 3,000 - RM 3,499 a month","Job Scopes: - Develop and maintain websites and web-based application with WordPress, WooCommerce & CMS - Designing, integrating, upgrading and maintaining the…"
13,INTERNSHIP-Full time Programmer to develop Websites and Apps,AQ Wise Sdn Bhd,,"INTERNSHIP- Full time Programmer to develop Websites and Apps.
Acquire Flutter programming skill or Willing to learn Flutter intensively."
14,Flutter Developer,ACD Development Sdn. Bhd,,"Within defined quality and performance standards.
Participate throughout the SDLC, including analysis, design, development, testing, integration, deployment and…"
15,Mobile Developer,Webpuppies,RM 30 - RM 140 an hour,Webpuppies strives to continuously equip itself with latest digital know-how and paves way for clients and partners to navigate the technology most effectively.
16,Junior Programmer,ZR TECHMOTION SDN BHD,"RM 2,000 - RM 2,500 a month","You will be working on full stack web system and mobile application development.
Study for Software Engineering Major.
Experience on MySQL database server."
17,Unity Developer,Hays,"RM 7,000 - RM 10,000 a month","You would be responsible for developing interactive experiences such as Augmented Reality & Virtual Reality, be it on any platform events, kiosks, mobile,…"
18,Junior Programmer,DE METROLOGY SDN BHD,,"You will be working on full stack web system and mobile application development.
Requirement: - Study for Software Engineering Major - Working experience on…"
19,Mobile Apps Developer,Agensi Pekerjaan Career Horizons,"RM 10,000 a month","• Transform business requirements into functional mobile apps.
Monitor, optimize and maintain high performance of the application."
20,Mobile Developer,Agensi Pekerjaan Synopsis Sdn Bnd,"RM 4,000 - RM 4,999 a month",Responsibilities: • Transform business requirement into mobile apps • Develop and maintain mobile application • Able to develop the modules within given…
21,Frontend Engineer,Technerve Technology Solutions Sdn Bhd,"RM 3,000 - RM 3,499 a month","Minimum 2 years experience in HTML, CSS, and Javascript.
Good understanding of responsive design and mobile optimized websites."
22,Mobile Developer (Flutter),Hays,,"You will be working with a team to develop and maintain high quality mobile applications.
You will design, develop, and improvise mobile applications using…"
23,Mobile App Developer,Todak Culture Sdn. Bhd.,,Translate UI / UX designs into high quality code  Develop new features for mobile applications  Assist and advise on UI / UX design capabilities of current…
24,Software Engineer II,Air Asia,,"The technology center comprises a team of software engineering and technology experts based in Malaysia, Bangalore, and Singapore, who would work to streamline…"
25,Web Front-End / Mobile Application Developer (Flutter),atQuest Solutions,,"Creates next generation mobile application for iOS and Android devices.
Responsible for the development, testing, release and support of the application’s…"
26,Mobile Application Developer,Nss It Solution Sdh Bhd,"RM 6,000 - RM 7,999 a month",Develop mobile Android and iOS applications • Applicant can possess one or more the following skill set: - Develop iOS application using Swift and/or Obj-C -…
27,Software Developer,Skylink Pacific Solutions Sdn Bhd,"RM 5,000 - RM 7,000 a month","Develop native Android mobile applications and web applications.
Understanding user requirements and provide options for improvised technical solution."
28,Software Developer,Pingspace Sdn. Bhd.,"RM 3,500 a month","Our Software Developers work on a range of problems: from the backend (designing database, designing operation optimization algorithms, designing communication…"
29,Full Stack Web Application Developer,Agensi Pekerjaan Allstaff Sdn Bhd,"RM 5,000 - RM 5,999 a month",Qualification: • Bachelor's Degree in Computer Science or equivalent Job Scope: • Developing front end website architecture.
30,Software Developer,EV-Dynamic Sdn Bhd,"RM 2,500 - RM 2,700 a month","Troubleshooting, debugging, and fixing errors, improve the performance or upgrade interfaces.
Responsible to produce clean and efficient code based on…"
31,Mobile App Developer,MOMENTUM INTERNET SDN. BHD.,,"Mengoptimize code, identify dan fix problem 4.
Kemahiran (DART, UI,UX, FLUTTER FRAMEWORK) Syarat Kelayakan : 1.
Berumur 22 - 30 Tahun dan sihat tubuh badan 6."
32,Mobile App Developer (Flutter),SOFAX SDN BHD,"RM 5,000 - RM 8,000 a month","Responsible in creating and enhance new features of existing and upcoming project.
Work closely with the project team for in-house application."
33,SYSTEM ANALYST PROGRAMMER (Flutter / PHP),GATES IT SOLUTION SDN BHD,,To responsible for production and maintenance of front end and backend of Web with Laravel 2) To complete sprint backlog within the given time.
34,Software Engineer - Backend,RF INFINITE SDN BHD,"RM 8,000 a month","Plans, schedules, and directs preparation of programs to process data and solve problems by use of computers: Consults with managerial and systems analysis…"
35,Mobile Developer,PRO OFFICE TECHNOLOGY SDN BHD,"RM 2,500 - RM 2,999 a month",We are looking for a Dart/Flutter Developer responsible for creating multi-platform apps for iOS and Android using Google’s Flutter development framework.
36,3D/Web GL Developer,Brandt International Sdn Bhd,"RM 7,000 a month","Design to scale from phones to tablets to desktop monitors.
Create AI-powered interactive 3D assets using WebGL, three.js or new web 3d framework/library."
37,IT Support Engineer,Ninja Van,,"Maintain and proactively improve the IT infrastructure of the company to avoid disruptions to operations.
Support and administer third party software and SaaS…"
38,Mobile App Developer,Marvel Media Sdn Bhd,,"Take ownership of the entire application lifecycle (concept, design, test, release and support).
Continuously research, evaluate and adapt new mobile…"
39,Software Developer (PHP),Nuren Group,,"Work in a team of full stack developers and UI/UX designers.
Develop robust, reliable & high traffic internet application (back-end, front-end, mobile)."
40,Mobile Application Developer,MSFM & ASSOCIATES,"RM 3,000 - RM 3,499 a month",View all MSFM & ASSOCIATES jobs - Cyberjaya jobsSalary Search: Mobile Application Developer salaries in Cyberjaya
41,Full-Stack Developer,AFIC Solutions,"RM 3,000 - RM 8,000 a month","Mobile: *Flutter, BLOC, Micro-service implementation.
Database: *SQL (Microsoft SQL Server / MySQL Server);
Good knowledge of Relational Databases."
42,Software Engineer Intern,RedSquare Technologies Sdn Bhd,"RM 1,200 - RM 2,000 a month","Mobile applications: Java, Kotlin, Swift, JavaScript (React Native), Dart (Flutter).
Degree in Computer Science or Information Technology or any similar…"
43,Front-End Developer,AGENSI PEKERJAAN EMCO EXECUTIVES SDN BHD,"RM 8,000 - RM 9,999 a month","Design, build and maintain high performance, reusable, responsive and reliable code and libraries.
Enhance application for maximum speed and scalability for…"
44,Front-end Engineer (Mobile Application),Chargeplus Sdn Bhd,"RM 4,000 - RM 6,000 a month","You are here not just to code, but also to contribute to business growth initiatives, collaborate with cross-border teams and come up with new tech solutions to…"
45,Head of Operations,JaGaApp,"RM 5,000 - RM 9,000 a month","Oversee the operation team to meet business targets and to provide great onboarding experience to our customers.
Excellent oral and written command of English."
46,Software Developer,QR Retail Automation (Asia) Sdn Bhd,"RM 3,000 - RM 3,499 a month","Involve all aspects of the software development cycle including analysis requirement, design, coding and testing, implementation and subsequent support."
47,Senior Software Engineer,Air Asia,,"The technology center comprises a team of software engineering and technology experts based in Malaysia, Bangalore, and Singapore, who would work to streamline…"
48,Customer Support,Ejen2u International Sdn Bhd,"RM 2,000 - RM 3,700 a month","Knowing some php, mysql, flutter and/or laravel is a plus.
Troubleshoot and respond to client based on the ticket assigned.
In house IT support issue."
49,Senior Mobile App Engineer,SKYMIND HOLDINGS BERHAD,,Job Description for Senior Mobile App Engineer: - Participate in design and developing of mobile user interface in collaboration with UI/UX team and backend…
50,Mobile App Developer,Graduan.com.my,,"Candidate must familiar in flutter application using Dart with at 1 to 2 years of working experience.
Participate in full mobile application development life…"
51,Software Engineer,RedSquare Technologies Sdn Bhd,"RM 4,000 - RM 5,001 a month","Mobile applications: Java, Kotlin, Swift, JavaScript (React Native), Dart (Flutter).
Degree in Computer Science or Information Technology or any similar…"
52,Mobile App Developer,SENWAVE RETAIL SOLUTIONS SDN BHD,"RM 3,000 - RM 5,000 a month","Work closely with customers, analysts, and team members to understand business requirements that drive the analysis and design of quality technical solutions."
53,Software Programmer,ACCOUNTSOFT ENTERPRISE SDN BHD,"RM 1,500 - RM 1,999 a month","Responsibility: - Analyze, design and develop Mobile Application.
Diagnosing issues and performing bug fix or software maintenance."
54,Full Stack Developer (Mobile & Web Application),Chargeplus Sdn Bhd,"RM 4,000 - RM 6,000 a month","You are here not just to code, but also to contribute to business growth initiatives, collaborate with cross-border teams and come up with new tech solutions to…"
55,Graduate Trainee - Mobile Application Developer,Agmo Studio Sdn Bhd,"RM 2,800 - RM 3,200 a month","Collaborate with cross-functional teams to design and develop mobile application.
Integrate with REST JSON API.
Post production monitoring and support."
56,UI/UX Designer + Developer,Brandt International Sdn Bhd,"RM 7,000 a month","Design to scale from phones to tablets to desktop monitors.
Create wireframes, mockups and prototypes for our analytic product."
57,Front-end Developer,Big Corridor Sdn Bhd,"RM 4,000 - RM 7,000 a month","Translate designs and mock-ups into front-end code.
Perform integrations between front-end and back-end interfaces.
Resolve bottlenecks, and software bugs."
58,Software Engineer,Brighten Business Consulting Sdn Bhd,"RM 7,000 - RM 10,000 a month","Developing and managing well-functioning databases and applications.
Developing front-end website architecture with appealing visual design."
59,WEB DEVELOPER,Prestige Cartrade Sdn Bhd,"RM 3,500 - RM 4,000 a month","This role requires strong analytical skills, information technologist, web solutions and data driven mindset to gain success in developing e-commerce platforms,…"
60,Mobile App Developer,Original Intelligence Sdn Bhd,"RM 4,000 - RM 6,000 a month","Develop, maintain, enhance and test mobile applications.
Maintain companyʼs IT infrastructure.
Provide technical support for software, hardware and network…"
61,Senior Software Engineer,FUSIONQB SDN BHD,"RM 6,500 - RM 12,000 a month","Build prototypes for presentation and demonstration.
Liaise with the senior executives and project sponsors for project requirements and deliverables."
62,Software Engineer,Big Corridor Sdn Bhd,"RM 4,000 - RM 7,000 a month","Translate application storyboards and use-cases into functional.
Engineering elegant solutions that solve business problems.
O Web API, Entity Framework on ."
63,Junior Software Engineer,GigWorld Inc,"RM 3,000 - RM 4,500 a month","Build and maintain Web Applications.
Build and maintain Mobile Applications.
Setup necessary automation test software technologies."
64,Mobile Developer,Razer USA Ltd.,,"Work closely with product management and design teams to develop cross platforms mobile applications.
Integrate with back-end services to enable new features."
65,MOBILE DEVELOPER,EBOSS INNOVATION SDN BHD,"RM 3,000 - RM 4,000 a month","*Developing, debugging and supporting* mobile applications (iOS/Android) and their infrastructure.
Be actively involved in *technical design *of the application…"
66,Senior Java / Spring Boot Developer,SHENMA CREDIT SDN BHD,"RM 5,000 - RM 7,000 a month","Be hands-on in analysis, development and bring craftsmanship mindset to deliver software with the highest standard of quality."
67,SENIOR QUALITY CONTROL ENGINEER (IT),VHGLOBAL SDN BHD,,"In-depth understanding of industry market trends and conditions.
Strong analytical and problem-solving skills. excellent verbal and written communications…"
68,IT Technician/Officer/Executive,Fitxcapes Sdn. Bhd.,"RM 2,000 - RM 5,000 a month",You will be primarily responsible for designing and developing the back-end of the web application but will also be tasked with integrating front-end components…
69,Software Engineer/ Developer,IME Group of Companies,"RM 2,800 a month",Carry out software programming and coding for Enterprise/Business Solutions according to specifications within specified timeline.
70,.NET Developer,AFIC Solutions,"RM 3,000 - RM 8,000 a month","Mobile* : Flutter, BLOC, Micro-service implementation.
Database* : SQL (Microsoft SQL Server / MySQL Server); Excellent knowledge of Relational Databases."
71,Senior iOS Mobile App Developer,ETCTECH GLOBAL SDN BHD,"RM 5,000 - RM 7,000 a month","Responsible for conceptualizing and designing next generation features for iOS application.
Communicate regularly and write clean code."
72,Full Stack Developer,Brandt International Sdn Bhd,"RM 7,000 a month","Design and implement responsive web & mobile applications from front to back using popular open source frameworks like MEAN, Ionic and Swagger."
73,Mobile Software Engineer (React Native),Excard Corporation Sdn Bhd,"RM 3,800 - RM 5,000 a month","Design, code and maintain mobile apps, from layout to function and according to a client's specifications.
Continue to innovate and improve our existing mobile…"
74,Mobile App Developer,CRE Inspiration Sdn Bhd,,"Must be able to develop and maintain mobile application.
With Flutter knowledge will be advantage.
Diploma / Advanced Diploma / Higher Graduate Diploma / DVM /…"
75,Full Stack Developer,Fortis Star Sdn Bhd,,Passion to build seamless web experiences and high-performing software Eager to learn new technologies to develop and innovate better software Keen to impart…
76,Backend Developer,Fast Hiring Jobs - part of Hiredly team,"RM 6,500 - RM 8,500 a month",Work closely with the tech lead and collaborate with the core organisation team in accordance with projects consists of web and mobile apps.
77,Solutions Consultant (Tech Lead),Worldline,,"Guide team debugging efforts (e.g. poor task management, unclear requirements, complex development process, etc)."
78,Mobile App Developer,QuickDesk Sdn Bhd,"RM 3,000 - RM 6,000 a month","You will be working on our mobile applications (iOS and/or Android);
Develop user-facing features for the mobile applications;"
79,Full time Developer/Programmer,Savor of Life,,"Must know Flutter/Dart 2.0.
Understand how BLoC State Management works in Flutter Framework.
Experience deploying Flutter Apps to Google Playstore & Apple…"
80,Mobile App Developer,WikiCareer Resources Sdn Bhd,"RM 2,700 - RM 4,500 a month","Mobile developerKey responsible• Support the entire application lifecycle (concept, design, test, release and support)• Produce fully functional mobile…"
81,Mobile App Developer Intern,Tinkerve LLP,RM 500 - RM 800 a week,"The role works collaboratively with Business Analysts, Backend developers and release management to develop new and exciting mobile applications."
82,Senior Software Engineer (Mobile Developer),AGENSI PEKERJAAN HUNTERS SEARCH SDN. BHD.,"RM 8,000 - RM 9,999 a month",Position Summary Senior Software Developer (Mobile Application) is part of the Solutions Delivery team to meet the skills and expertise needs in supporting…
83,Frontend Developer,Fast Hiring Jobs - part of Hiredly team,"RM 6,500 - RM 8,500 a month","Build reusable code and libraries for various projects.
Collaborate with other developers, designers, and architects to meet application requirements and…"
84,Senior Software Engineer,REDtone Telecommunications Sdn Bhd,"RM 5,000 - RM 10,000 a month","The Software Engineer is responsible to perform analysis, design and coding of functional requirements specifications of applications."
85,Flutter Mobile Developer,Randstad,"RM 4,000 - RM 10,000 a month","Participate in the deployment of system including user requirement scoping, design, coding, testing, and implementation."
86,iOS/Android Developer,HEXA INITIATIVE SDN BHD,,"Handle maintenance of mobile apps such as bug fixes and version updates.
Ensure work delivered in timely manner • Effective and work quickly with team members…"
87,Software Developer (PHP),Enlinea Sdn Bhd,"RM 4,000 - RM 4,999 a month","Develop robust, reliable & high traffic internet application (back-end, front-end, mobile).
Maintain and constantly optimize system, process and user experience…"
88,Mobile Application Developer (Flutter),EPS Malaysia,"RM 4,000 - RM 6,000 a month","Design and build sophisicated and highly scalable apps using Flutter.
Support the entire application lifestyle (concept, design, test, release and support)."
89,System Analyst / Analyst Programmer,Subur Tiasa Holdings Berhad,,"Job Responsibility:To play a proactive role in deriving system solutions to any given business requirement or problem To design, develop, integrate, test,…"
90,Mobile Developer,Razer USA Ltd.,,"Work closely with product management and design teams to develop cross platforms mobile applications.
Integrate with back-end services to enable new features."
91,MOBILE DEVELOPER,EBOSS INNOVATION SDN BHD,"RM 3,000 - RM 4,000 a month","*Developing, debugging and supporting* mobile applications (iOS/Android) and their infrastructure.
Be actively involved in *technical design *of the application…"
92,Senior Java / Spring Boot Developer,SHENMA CREDIT SDN BHD,"RM 5,000 - RM 7,000 a month","Be hands-on in analysis, development and bring craftsmanship mindset to deliver software with the highest standard of quality."
93,SENIOR QUALITY CONTROL ENGINEER (IT),VHGLOBAL SDN BHD,,"In-depth understanding of industry market trends and conditions.
Strong analytical and problem-solving skills. excellent verbal and written communications…"
94,IT Technician/Officer/Executive,Fitxcapes Sdn. Bhd.,"RM 2,000 - RM 5,000 a month",You will be primarily responsible for designing and developing the back-end of the web application but will also be tasked with integrating front-end components…
95,Software Engineer/ Developer,IME Group of Companies,"RM 2,800 a month",Carry out software programming and coding for Enterprise/Business Solutions according to specifications within specified timeline.
96,.NET Developer,AFIC Solutions,"RM 3,000 - RM 8,000 a month","Mobile* : Flutter, BLOC, Micro-service implementation.
Database* : SQL (Microsoft SQL Server / MySQL Server); Excellent knowledge of Relational Databases."
97,Senior iOS Mobile App Developer,ETCTECH GLOBAL SDN BHD,"RM 5,000 - RM 7,000 a month","Responsible for conceptualizing and designing next generation features for iOS application.
Communicate regularly and write clean code."
98,Full Stack Developer,Brandt International Sdn Bhd,"RM 7,000 a month","Design and implement responsive web & mobile applications from front to back using popular open source frameworks like MEAN, Ionic and Swagger."
99,Mobile App Developer,CRE Inspiration Sdn Bhd,,"Must be able to develop and maintain mobile application.
With Flutter knowledge will be advantage.
Diploma / Advanced Diploma / Higher Graduate Diploma / DVM /…"
100,Senior Mobile App Engineer,Skymind Global,,"Participate in design and developing of mobile user interface in collaboration with UI/UX team and backend team, taking new initiatives, grow technical insight…"
101,Senior iOS Developer,Snappymob,"RM 8,000 - RM 10,000 a month","Architect, design, develop, and maintain iOS applications.
Collaborate with the engineering team at large in software design sessions, code reviews, teaching,…"
102,Senior App Developer,AccVen Sdn Bhd,"RM 5,000 - RM 8,000 a month","Develop new and complete modules, and then enhance existing modules of existing product architecture.
Fully execute user testing on the modules."
103,Mid-level / Senior JavaScript Developer,Lava X Technologies,"RM 4,000 - RM 8,000 a month",Collaborate with product management to translate product requirements to system-level architecture and high-level design that can be reused across multiple…
104,PHP Programmer,Tornado Internet Sdn Bhd,"RM 2,200 - RM 6,000 a month","And from ""Toe"" to ""Head"" to manage.
Required language(s): English and Mandarin(must be able to read,write and speak Mandarin)."
105,MOBILE DEVELOPER,Unixus Solutions,,"Implement and maintain our mobile applications.
Designing and consuming APIs in mobile applications.
Design client & server (mobile) application structure and…"
106,Android Mobile Software Engineer,Ingenious Job,"RM 7,000 - RM 14,000 a month","BS degree in Computer Science or related field.
Minimum 5 yearsâ€™ experience in mobile development (Android).
Skilled in automated unit and UI testing ."
107,Senior Software Developer / Engineer,SECURE365 NEXTGEN SOLUTIONS SDN BHD,"RM 4,000 - RM 6,000 a month","Work closely with the technical lead in collecting and documenting user's requirements, development of user stories, timeline and effort estimation."
108,Front End Software Developer,SECURE365 NEXTGEN SOLUTIONS SDN BHD,"RM 3,500 - RM 5,500 a month","Work closely with the technical lead in collecting and documenting user's requirements, development of user stories, timeline and effort estimation."
109,Mobile App Developer (iOS),C Speed Network Technology Sdn Bhd,,"Candidate must possess at least Diploma/Advanced/Higher/Graduate Diploma, Bachelor's Degree/Post Graduate Diploma/Professional Degree in Computer Science…"
110,Fullstack developer,Cargo Move,"RM 3,800 - RM 5,000 a month","Work with development teams and product managers to ideate software solutions.
Design client-side and server-side architecture."
111,Support Engineer I 5 days week I Up to SGD3000,Agensi Pekerjaan Nala Sdn Bhd,,"Experience in collaboration tools, i.e. Git, Jira, Slack and angular &/or flutter.
Act as the first point of contact for all user support related queries for…"
112,Software Engineer / Web Developer,EasyStore,"RM 4,000 - RM 8,000 a month","Manage codes in multiple server environment.
Optimize codes for high volume transaction.
Love to solve problems with coding."
113,Fullstack Developer,CareerMaster Sdn Bhd,"RM 6,000 a month","Responsible for building world-class applications together with our highly collaborative teams.
Design, develop and manage the company Java-based applications."
114,QA Lead (Automation),Agensi Pekerjaan Career Channel Sdn Bhd,"RM 10,000 - RM 12,000 a month","Serves as the QA Team Lead, responsible for Test Automation.
Lead approximately 4 QA, negotiate scope, develop estimates, plans, monitoring metrics, and provide…"
