,title,company,location,salary,description
0,Snr Flutter Developer,Green Packet International Sdn Bhd,Selangor,,"Job Responsibilities:

Designs, develops, and provides customization of various…"
1,Flutter Developer,4X Software Sdn Bhd,Cyberjaya,,"Your role As a Flutter Developer at Deriv, you will be responsible for designing and developing applications for iOS and Android platforms while working closely…"
2,Flutter Developer,Brandt International Sdn Bhd,Kuala Lumpur,"RM 6,000 a month",Develop state of the art highly interactive and rich animation experience for mobile and desktop app using Flutter.
3,Software Developer,MAXUNITY TECHNOLOGY SDN BHD,Puchong,"RM 3,000 - RM 5,000 a month","Candidate must possess at least Diploma/Advanced/Higher/Graduate Diploma, Bachelor's Degree/Post-Graduate Diploma/Professional Degree in Engineering (Computer…"
4,Wordpress & Mobile App Developer,Advance Plus Property Management Sdn Bhd,Bukit Gelugor,"RM 3,000 - RM 3,499 a month","Job Scopes: - Develop and maintain websites and web-based application with WordPress, WooCommerce & CMS - Designing, integrating, upgrading and maintaining the…"
5,Android Developer 1,Sicpa,Malaysia,,"Work on defining and implementing nextWork on defining and implementing next-generation, innovative architecture for Android mobile application."
6,Web Front-End / Mobile Application Developer (Flutter),atQuest Solutions,Kuala Lumpur,,"Creates next generation mobile application for iOS and Android devices.
Responsible for the development, testing, release and support of the application’s…"
7,Mobile App Developer,QuickDesk,Malaysia,,"You will be working on our mobile applications (iOS and/or Android);
Develop user-facing features for the mobile applications;"
8,Mobile Developer (Flutter),Hays,Malaysia,,"You will be working with a team to develop and maintain high quality mobile applications.
You will design, develop, and improvise mobile applications using…"
9,Flutter Developer,BEEDUCATION ADVENTURES SDN BHD,Subang Jaya,,"Within defined quality and performance standards.
Participate throughout the SDLC, including analysis, design, development, testing, integration, deployment and…"
10,Internship for Computer IT (Web Programmer),Dideta Multitech Sdn Bhd,Pasir Puteh,"RM 1,200 a month",Testing and de-bugging to make sure our platform runs smoothly Data processing and analysis Exposure to cloud technologies Requirements: Candidate must possess…
11,Software Engineer,Wemabox Solutions Sdn. Bhd.,Ipoh,"RM 3,000 - RM 3,499 a month","Job Description Software Engineer is responsible to design and implement system, feature, and solutions business needs."
12,Flutter Developer,ACD Development Sdn. Bhd,Subang Jaya,,"Within defined quality and performance standards.
Participate throughout the SDLC, including analysis, design, development, testing, integration, deployment and…"
13,Flutter Developer,Snaphunt,Kuala Lumpur,,"The OfferOpportunity within an award-winning people development solutions firmBe involved in developing high-impact products Work in a fast-paced, startup…"
14,Junior Full Stack Developer I WFH & Office-Hybrid,AGTIV Consulting Sdn Bhd,Kuala Lumpur•Remote,"RM 3,500 - RM 3,999 a month","Our projects are with some of the largest banks, insurance, oil & gas as well as pharmaceutical companies in Malaysia, Singapore, India, France, and beyond."
15,Internship 2022 - IT/Computer Science/Software Engineering,GNey Software Sdn Bhd,Masai,,View all GNey Software Sdn Bhd jobs - Masai jobsSalary Search: Internship 2022 - IT/Computer Science/Software Engineering salaries
16,Unity Developer,Hays,Malaysia,"RM 7,000 - RM 10,000 a month","You would be responsible for developing interactive experiences such as Augmented Reality & Virtual Reality, be it on any platform events, kiosks, mobile,…"
17,"Full Stack Web Application Developer @ Butterworth, Penang",PERSOLKELLY,George Town,"RM 2,500 - RM 3,500 a month","Developing back end website applications.
Ensuring cross-platform optimization for mobile phones.
Working alongside graphic designers for web design features."
18,INTERNSHIP-Full time Programmer to develop Websites and Apps,AQ Wise Sdn Bhd,Shah Alam•Remote,,"INTERNSHIP- Full time Programmer to develop Websites and Apps.
Acquire Flutter programming skill or Willing to learn Flutter intensively."
19,Developer Computer Science Intern (6 months),Mysuri Biz Technologies Sdn Bhd,Cyberjaya,"RM 1,200 a week","Stack : HTML CSS JavaScript jQuery - Good to have basic knowledge in back-end framework like laravel / nodejs, but not compulsory - Fresh grad is encouraged to…"
20,Account Executive (Digital Media Project),Nuren Group,Malaysia,,"You will play the account management role in handling our advertiser's digital media projects & campaigns.
You are responsible for managing the flow of work for…"
21,Mobile Application Developer,Innovatz Solutions Sdn. Bhd,Subang Jaya,"RM 10,765 - RM 12,500 a month","Develop mobile applications using React Native framework/Expo.
Participate in the entire product’s lifecycle (analyze, develop, test, release, support)."
22,Mobile Software Engineer - iOS,Sicpa,Malaysia,,"Work on defining and implementing next-generation, innovative architecture for iOS mobile application.
Apply mobile application architecture principles, such as…"
23,FULL STACK WEB APPLICATION DEVELOPER,BLUEWARE MALAYSIA SDN BHD,Butterworth,,"Designing user interactions on web pages.
Developing back end website applications.
Creating servers and databases for functionality."
24,Software Engineer,World Syntecjh Solution Sdn Bhd,Bukit Mertajam,"RM 2,000 - RM 2,499 a month","Responsibilities - Developing, design, testing, and implementation for web and software application project - Develop technical and user documentation."
25,Associate/Senior Mobile Engineer (Flutter),Astro,Kuala Lumpur,,"The role will build, enhance and monitor mobile apps of ASTRO digital products, in a team that is focused on quality and security of mobile appsWhat you will do…"
26,IT Support Engineer,Ninja Van,Shah Alam,,"Maintain and proactively improve the IT infrastructure of the company to avoid disruptions to operations.
Support and administer third party software and SaaS…"
27,Mobile App Developer,Marvel Media Sdn Bhd,Jelutong,,"Take ownership of the entire application lifecycle (concept, design, test, release and support).
Continuously research, evaluate and adapt new mobile…"
28,Mobile Apps Developer,Agensi Pekerjaan Career Horizons,Kuala Lumpur•Remote,"RM 10,000 a month","• Transform business requirements into functional mobile apps.
Monitor, optimize and maintain high performance of the application."
29,PHP developer,Agensi Pekerjaan Synopsis Sdn Bnd,Cyberjaya,"RM 4,000 - RM 4,999 a month",Requirements: ✅ Have extensive knowledge in exploring API and UI standards ✅ Familiar with php/laravel framework ✅ Familiar with flutter framework (Added…
30,Web & Apps Developer,BLUEDALE INTEGRATED (M) SDN. BHD.,Petaling Jaya,,"Responsible for designing, coding and modifying websites, from layout to function.
Strive to create visually appealing sites that feature user-friendly design…"
31,Mobile Developer,Tamarix Onesolutions Sdn Bhd,Cyberjaya,"RM 4,000 - RM 7,000 a month","✅ Familiar with flutter framework (Added Advantage).
✅ Transform business requirement into mobile apps.
✅ Experienced in IOS and Android Developments."
32,3D/Web GL Developer,Brandt International Sdn Bhd,Kuala Lumpur,"RM 7,000 a month","Design to scale from phones to tablets to desktop monitors.
Create AI-powered interactive 3D assets using WebGL, three.js or new web 3d framework/library."
33,Software Developer,Pingspace Sdn. Bhd.,Bayan Lepas•Temporarily Remote,"RM 3,500 a month","Our Software Developers work on a range of problems: from the backend (designing database, designing operation optimization algorithms, designing communication…"
34,Full Stack Developer,IMT Tech Sdn Bhd,Kuala Lumpur,"RM 6,000 - RM 8,000 a month","Have experience working with 1 PHP MVC framework like Laravel, Yii, CI and willing to convert to Laravel.
Have experience and passion for Front-end Development…"
35,Software Engineer,Motorola Solutions,Penang,,And in everyday moments — when a package arrives just in time for the holiday or when a child doesn’t miss the school bus home.
36,Mobile Application Developer (Cross Platform),Whip Technology Sdn Bhd,Damansara Utama•Temporarily Remote,"RM 2,200 - RM 2,500 a month","Develop intuitive and user friendly cross platform application for mobile and tablet devices,.
Support entire application lifecycle (concept, design, test,…"
37,Full Stack Web Application Developer,Agensi Pekerjaan Allstaff Sdn Bhd,Butterworth,"RM 5,000 - RM 5,999 a month",Qualification: • Bachelor's Degree in Computer Science or equivalent Job Scope: • Developing front end website architecture.
38,Mobile Application Developer,INNOVATZ SOLUTIONS SDN BHD,Kuala Lumpur,"RM 13,000 - RM 15,999 a year","Responsibility : • Develop mobile applications using React Native framework/Expo • Participate in the entire product’s lifecycle (analyze, develop, test,…"
39,Junior Programmer,ZR TECHMOTION SDN BHD,Kajang•Temporarily Remote,"RM 2,000 - RM 2,500 a month","You will be working on full stack web system and mobile application development.
Study for Software Engineering Major.
Experience on MySQL database server."
40,Mobile App Developer,Wemabox Solutions Sdn. Bhd.,Ipoh,"RM 3,000 - RM 3,499 a month","Job Description Mobile App Developer is responsible to design and implement system, feature, and solutions business needs."
41,Mobile App Developer (PJ area/Up to 6k/MS SQL),Agensi Pekerjaan Times Management Consultancy Sdn...,Ara Damansara,"RM 3,000 - RM 6,000 a month","Developing customized solutions for the mobile platform.
Designing, coding, and implementing mobile applications.
Stay up-to-date with new technology trends."
42,Flutter Developer,Hays,Malaysia,"RM 8,000 a month","In this team, you will be working closely with the developers, Project Managers, Solution Architect and other members of the project team."
43,"Manager, Operations Solutions",Skylink Pacific Solutions Sdn Bhd,Kuala Lumpur,,Job Responsibilities • Oversee operations solutions’ development and implementation of projects that contribute to the improvement and standardization of the…
44,Software Developer,EV-Dynamic Sdn Bhd,Putra Heights,"RM 2,500 - RM 2,700 a month","Troubleshooting, debugging, and fixing errors, improve the performance or upgrade interfaces.
Responsible to produce clean and efficient code based on…"
45,Front-end Engineer (Mobile Application),Chargeplus Sdn Bhd,Kuala Lumpur,"RM 4,000 - RM 6,000 a month","You are here not just to code, but also to contribute to business growth initiatives, collaborate with cross-border teams and come up with new tech solutions to…"
46,Mobile App Developer (PJ area/Up to 6k/MS SQL),Agensi Pekerjaan Times Management Consultancy Sdn...,Ara Damansara,"RM 3,000 - RM 6,000 a month","Developing customized solutions for the mobile platform.
Designing, coding, and implementing mobile applications.
Stay up-to-date with new technology trends."
47,Software Developer,Pingspace Sdn. Bhd.,Bayan Lepas•Temporarily Remote,"RM 3,500 a month","Our Software Developers work on a range of problems: from the backend (designing database, designing operation optimization algorithms, designing communication…"
48,Full Stack Developer (Mobile & Web Application),Chargeplus Sdn Bhd,Kuala Lumpur,"RM 4,000 - RM 6,000 a month","You are here not just to code, but also to contribute to business growth initiatives, collaborate with cross-border teams and come up with new tech solutions to…"
49,Developer,Skylink Pacific Solutions Sdn Bhd,Kuala Lumpur,,Job Responsibilities  Develop native Android mobile applications and web applications  Understanding user requirements and provide options for improvised…
50,Software Developer,EV-Dynamic Sdn Bhd,Putra Heights,"RM 2,500 - RM 2,700 a month","Troubleshooting, debugging, and fixing errors, improve the performance or upgrade interfaces.
Responsible to produce clean and efficient code based on…"
51,Software Developer,Skylink Pacific Solutions Sdn Bhd,Kuala Lumpur•Temporarily Remote,"RM 5,000 - RM 7,000 a month","Develop native Android mobile applications and web applications.
Understanding user requirements and provide options for improvised technical solution."
52,Software Developer (PHP),Nuren Group,Malaysia,,"Work in a team of full stack developers and UI/UX designers.
Develop robust, reliable & high traffic internet application (back-end, front-end, mobile)."
53,Mobile App Developer,MOMENTUM INTERNET SDN. BHD.,Kluang,,"Mengoptimize code, identify dan fix problem 4.
Kemahiran (DART, UI,UX, FLUTTER FRAMEWORK) Syarat Kelayakan : 1.
Berumur 22 - 30 Tahun dan sihat tubuh badan 6."
54,Junior/Senior Software Engineer (软件工程师),DD Online Services & Enterprise,Johor Bahru,"RM 3,000 - RM 10,000 a month","Accommodation provided for non-Johorian.
Travel leaves with air ticket allowance.
Annual leave and sick leave.
Develop and deliver features in a timely matter."
55,Mobile Developer,Razer USA Ltd.,Kuala Lumpur•Remote,,"Work closely with product management and design teams to develop cross platforms mobile applications.
Integrate with back-end services to enable new features."
56,Mobile App Developer Intern,Tinkerve LLP,Kuala Lumpur,RM 500 - RM 800 a week,"The role works collaboratively with Business Analysts, Backend developers and release management to develop new and exciting mobile applications."
57,Mobile App Developer (Flutter),SOFAX SDN BHD,Bandar Sunway,"RM 5,000 - RM 8,000 a month","Responsible in creating and enhance new features of existing and upcoming project.
Work closely with the project team for in-house application."
58,UI/UX Designer + Developer,Brandt International Sdn Bhd,Kuala Lumpur,"RM 7,000 a month","Design to scale from phones to tablets to desktop monitors.
Create wireframes, mockups and prototypes for our analytic product."
59,Mobile Application Developer,Nss It Solution Sdh Bhd,Cyberjaya,"RM 6,000 - RM 7,999 a month",Develop mobile Android and iOS applications • Applicant can possess one or more the following skill set: - Develop iOS application using Swift and/or Obj-C -…
60,Front-end Developer,Big Corridor Sdn Bhd,Selangor,"RM 4,000 - RM 7,000 a month","Translate designs and mock-ups into front-end code.
Perform integrations between front-end and back-end interfaces.
Resolve bottlenecks, and software bugs."
61,Flutter Developer,EPS Malaysia,Kuala Lumpur,,View all EPS Malaysia jobs - Kuala Lumpur jobsSalary Search: Flutter Developer salaries in Kuala Lumpur
62,SYSTEM ANALYST PROGRAMMER (Flutter / PHP),GATES IT SOLUTION SDN BHD,Johor Bahru,,To responsible for production and maintenance of front end and backend of Web with Laravel 2) To complete sprint backlog within the given time.
63,Full Stack Developer,Brandt International Sdn Bhd,Kuala Lumpur,"RM 7,000 a month","Design and implement responsive web & mobile applications from front to back using popular open source frameworks like MEAN, Ionic and Swagger."
64,Customer Support,Ejen2u International Sdn Bhd,Puchong,"RM 2,000 - RM 3,700 a month","Knowing some php, mysql, flutter and/or laravel is a plus.
Troubleshoot and respond to client based on the ticket assigned.
In house IT support issue."
65,Graduate Trainee - Mobile Application Developer,Agmo Studio Sdn Bhd,Kota Damansara,"RM 2,800 - RM 3,200 a month","Collaborate with cross-functional teams to design and develop mobile application.
Integrate with REST JSON API.
Post production monitoring and support."
66,Backend Developer,Fast Hiring Jobs - part of Hiredly team,Bandar Kinrara•Remote,"RM 6,500 - RM 8,500 a month",Work closely with the tech lead and collaborate with the core organisation team in accordance with projects consists of web and mobile apps.
67,Junior Software Engineer,GigWorld Inc,Petaling Jaya,"RM 3,000 - RM 4,500 a month","Build and maintain Web Applications.
Build and maintain Mobile Applications.
Setup necessary automation test software technologies."
68,Junior/Senior Software Engineer (软件工程师),DD Online Services & Enterprise,Johor Bahru,"RM 3,000 - RM 10,000 a month","Accommodation provided for non-Johorian.
Travel leaves with air ticket allowance.
Annual leave and sick leave.
Develop and deliver features in a timely matter."
69,UI/UX Designer + Developer,Brandt International Sdn Bhd,Kuala Lumpur,"RM 7,000 a month","Design to scale from phones to tablets to desktop monitors.
Create wireframes, mockups and prototypes for our analytic product."
70,MOBILE DEVELOPER,EBOSS INNOVATION SDN BHD,Petaling Jaya,"RM 3,000 - RM 4,000 a month","*Developing, debugging and supporting* mobile applications (iOS/Android) and their infrastructure.
Be actively involved in *technical design *of the application…"
71,Full-Stack Developer,AFIC Solutions,Kuala Lumpur,"RM 3,000 - RM 8,000 a month","Mobile: *Flutter, BLOC, Micro-service implementation.
Database: *SQL (Microsoft SQL Server / MySQL Server);
Good knowledge of Relational Databases."
72,Mobile Application Developer (Flutter),EPS Malaysia,Kuala Lumpur,"RM 4,000 - RM 6,000 a month","Design and build sophisicated and highly scalable apps using Flutter.
Support the entire application lifestyle (concept, design, test, release and support)."
73,Software Engineer / Web Developer,EasyStore Commerce Sdn Bhd,Puchong•Temporarily Remote,,"Manage codes in multiple server environment.
Optimize codes for high volume transaction.
Research on new technologies (a better and easier way to solve the same…"
74,Senior Java / Spring Boot Developer,SHENMA CREDIT SDN BHD,Kuala Lumpur,"RM 5,000 - RM 7,000 a month","Be hands-on in analysis, development and bring craftsmanship mindset to deliver software with the highest standard of quality."
75,Software Developer (PHP),Nuren Group,Malaysia,,"Work in a team of full stack developers and UI/UX designers.
Develop robust, reliable & high traffic internet application (back-end, front-end, mobile)."
76,Mobile App Developer,MOMENTUM INTERNET SDN. BHD.,Kluang,,"Mengoptimize code, identify dan fix problem 4.
Kemahiran (DART, UI,UX, FLUTTER FRAMEWORK) Syarat Kelayakan : 1.
Berumur 22 - 30 Tahun dan sihat tubuh badan 6."
77,Junior/Senior Software Engineer (软件工程师),DD Online Services & Enterprise,Johor Bahru,"RM 3,000 - RM 10,000 a month","Accommodation provided for non-Johorian.
Travel leaves with air ticket allowance.
Annual leave and sick leave.
Develop and deliver features in a timely matter."
78,Mobile Developer,Razer USA Ltd.,Kuala Lumpur•Remote,,"Work closely with product management and design teams to develop cross platforms mobile applications.
Integrate with back-end services to enable new features."
79,Mobile App Developer Intern,Tinkerve LLP,Kuala Lumpur,RM 500 - RM 800 a week,"The role works collaboratively with Business Analysts, Backend developers and release management to develop new and exciting mobile applications."
80,Mobile App Developer (Flutter),SOFAX SDN BHD,Bandar Sunway,"RM 5,000 - RM 8,000 a month","Responsible in creating and enhance new features of existing and upcoming project.
Work closely with the project team for in-house application."
81,UI/UX Designer + Developer,Brandt International Sdn Bhd,Kuala Lumpur,"RM 7,000 a month","Design to scale from phones to tablets to desktop monitors.
Create wireframes, mockups and prototypes for our analytic product."
82,Mobile Application Developer,Nss It Solution Sdh Bhd,Cyberjaya,"RM 6,000 - RM 7,999 a month",Develop mobile Android and iOS applications • Applicant can possess one or more the following skill set: - Develop iOS application using Swift and/or Obj-C -…
83,Graduate Trainee - Mobile Application Developer,Agmo Studio Sdn Bhd,Kota Damansara,"RM 2,800 - RM 3,200 a month","Collaborate with cross-functional teams to design and develop mobile application.
Integrate with REST JSON API.
Post production monitoring and support."
84,Customer Support,Ejen2u International Sdn Bhd,Puchong,"RM 2,000 - RM 3,700 a month","Knowing some php, mysql, flutter and/or laravel is a plus.
Troubleshoot and respond to client based on the ticket assigned.
In house IT support issue."
85,Mobile Apps Developer (Full-stack),Mysuri Biz Technologies Sdn Bhd,Cyberjaya,,Stack : HTML CSS JavaScript jQuery - Understands Repository Design Pattern - Able to write fully-functional API codes - Good to have basic knowledge in back-end…
86,WEB & APPS DEVELOPER,Bluedale Publishing (M) Sdn Bhd,Petaling Jaya,,"Responsible for designing, coding and modifying websites, from layout to function.
Strive to create visually appealing sites that feature user-friendly design…"
87,Web Application Developer (Front End/ Full Stack),MHub,Subang Jaya,"RM 4,000 - RM 8,000 a month","Write well designed, testable, efficient code by using best software development practices.
Integrate data from various back-end services and databases."
88,Associate/Senior Mobile Engineer,Astro,Bukit Jalil,,"The role will build, enhance and monitor mobile apps of ASTRO digital products, in a team that is focused on quality and security of mobile apps."
89,Software Engineer,Big Corridor Sdn Bhd,Selangor,"RM 4,000 - RM 7,000 a month","Translate application storyboards and use-cases into functional.
Engineering elegant solutions that solve business problems.
O Web API, Entity Framework on ."
90,Senior Software Engineer,AirAsia,Kuala Lumpur+1 location,,"The technology center comprises a team of software engineering and technology experts based in Malaysia, Bangalore, and Singapore, who would work to streamline…"
91,WEB & APPS DEVELOPER,BLUEDALE MEDIA (M) SDN. BHD.,Petaling Jaya,,"Responsible for designing, coding and modifying websites, from layout to function.
Strive to create visually appealing sites that feature user-friendly design…"
92,Mobile / Web Developer,Plant Cartridge Sdn Bhd,Bandar Sunway,"RM 4,000 - RM 6,000 a month","Bachelor’s Degree / Diploma / Certificate in computer science or any related field.
At least one to three years of solid working experience in Mobile/Web…"
93,Mobile Software Engineer (React Native),Excard Corporation Sdn Bhd,Kedah•Remote,"RM 3,800 - RM 5,000 a month","Design, code and maintain mobile apps, from layout to function and according to a client's specifications.
Continue to innovate and improve our existing mobile…"
94,Senior iOS Mobile App Developer,ETCTECH GLOBAL SDN BHD,Kuala Lumpur+1 location•Temporarily Remote,"RM 5,000 - RM 7,000 a month","Responsible for conceptualizing and designing next generation features for iOS application.
Communicate regularly and write clean code."
95,Senior Software Engineer,REDtone Telecommunications Sdn Bhd,Puchong,"RM 5,000 - RM 10,000 a month","The Software Engineer is responsible to perform analysis, design and coding of functional requirements specifications of applications."
96,Flutter Mobile Developer,Randstad,Kuala Lumpur,"RM 4,000 - RM 10,000 a month","Participate in the deployment of system including user requirement scoping, design, coding, testing, and implementation."
97,iOS Developer,Snaphunt,Johor Bahru,,"Transferring existing iOS application to React Native Platform.
Writing well-designed, testable and efficient code.
You possess strong knowledge of IOS, ASP."
98,Senior Mobile App Engineer,SKYMIND HOLDINGS BERHAD,Penang,,Job Description for Senior Mobile App Engineer: - Participate in design and developing of mobile user interface in collaboration with UI/UX team and backend…
99,Senior Software Developer,Plus Xnergy,Bukit Jalil,"RM 4,604 - RM 11,276 a month",Work in full stack development from micro services architecture which interconnect all services to create an optimum system to building in-house dashboard…
100,Senior Software Engineer,FUSIONQB SDN BHD,Bangsar South,"RM 6,500 - RM 12,000 a month","Build prototypes for presentation and demonstration.
Liaise with the senior executives and project sponsors for project requirements and deliverables."
101,Frontend Developer,Fast Hiring Jobs - part of Hiredly team,Bandar Kinrara,"RM 6,500 - RM 8,500 a month","Build reusable code and libraries for various projects.
Collaborate with other developers, designers, and architects to meet application requirements and…"
102,Web Developer,Mama Net,Petaling Jaya,"RM 2,500 - RM 3,500 a month","To work on the current platforms enhancements and new features to be adopted on web applications, database and API Accurately translate user and business needs…"
103,Mobile App Developer,Cloone Corporation,Ara Damansara,"RM 2,500 - RM 6,000 a month","Work closely with customers, analysts, and team members to understand business requirements that drive the analysis and design of quality technical solutions."
104,Front End Developer,Versa Asia,Kuala Lumpur,"RM 6,000 - RM 16,000 a month",We are looking for a strong front end mobile and web app developer who welcomes both engineering and maintenance tasks.
105,MOBILE DEVELOPER,Unixus Solutions,Shah Alam,,"Implement and maintain our mobile applications.
Designing and consuming APIs in mobile applications.
Design client & server (mobile) application structure and…"
106,"AVP, Mobile Engineer Lead - iOS",Astro,Bukit Jalil,,"The role will build, enhance and monitor mobile apps of ASTRO digital products , in a team that is focused on quality and security of mobile apps ."
107,Solutions Consultant (Tech Lead),Worldline,Kuala Lumpur,,"Guide team debugging efforts (e.g. poor task management, unclear requirements, complex development process, etc)."
108,Mobile App Developer,TillJannah Sdn. Bhd.,Gombak,"RM 2,000 - RM 6,000 a month","Must possess at least 3 years of experience in developing mobile app, either Android or iOS.
Good communication skills in Bahasa Melayu and English."
