,title,company,location,salary,description
110,Fullstack Developer,Fast Hiring Jobs - part of Hiredly team,Bandar Kinrara,"RM 6,500 - RM 8,500 a month","Design and develop our front-end application using ReactJS.
Be involved in the entire product development process from conception, design, coding (back-end code…"
111,Software Developer (PHP Full Stack),Enlinea Sdn Bhd,Petaling Jaya,,"Develop robust, reliable & high traffic internet application (back-end, front-end, mobile).
Maintain and constantly optimize system, process and user experience…"
112,"Mobile Application Developer I 5 days I Up to SGD6,000",Agensi Pekerjaan Nala Sdn Bhd,Johor Bahru,, Familiar with NoSQL and/or cloud database (Cloud Firestore or MongoDB) and experience with flutter Programming language.
113,Software Developer (PHP),Enlinea Sdn Bhd,Petaling Jaya,"RM 4,000 - RM 4,999 a month","Develop robust, reliable & high traffic internet application (back-end, front-end, mobile).
Maintain and constantly optimize system, process and user experience…"
114,Mobile App Developer,TillJannah Sdn. Bhd.,Gombak,"RM 2,000 - RM 6,000 a month","Must possess at least 3 years of experience in developing mobile app, either Android or iOS.
Good communication skills in Bahasa Melayu and English."
115,Software Developer (Frontend),SCIKEY,Kuala Lumpur,,"Manage the development of software programs and IT systems according to detailed.
Technical specifications using quality processes, tools and methodologies."
116,Mid-level / Senior JavaScript Developer,Lava X Technologies,Puchong,"RM 4,000 - RM 8,000 a month",Collaborate with product management to translate product requirements to system-level architecture and high-level design that can be reused across multiple…
117,Senior Engineer/Engineer R&D,Carsome,Petaling Jaya,,"The Senior R&D Engineer will focus more on exploring new technologies, framework, or platform for upcoming projects."
118,Software Developer,SCIKEY,Kuala Lumpur,,"Delivery & Execution capability, within the IT Operating Model.
The Software Developer is expected to manage the software building and system development."
119,Android Mobile Software Engineer,Ingenious Job,Cyberjaya,"RM 7,000 - RM 14,000 a month","BS degree in Computer Science or related field.
Minimum 5 yearsâ€™ experience in mobile development (Android).
Skilled in automated unit and UI testing ."
120,iOS Developer (Mandarin speaking),StoreHub,Petaling Jaya,,"In the iOS Developer role, you’d be responsible for managing the larger apps in terms of designing, developing and testing the complete applications."
121,Senior App Developer,AccVen Sdn Bhd,Damansara Utama,"RM 5,000 - RM 8,000 a month","Develop new and complete modules, and then enhance existing modules of existing product architecture.
Fully execute user testing on the modules."
122,IOS Developer,Capgemini Services Malaysia Sdn Bhd,Kuala Lumpur,,"You should have a strong knowledge of iOS frameworks and proficiency in Objective-C.
If you have knowledge of iOS patterns and practices and are passionate…"
123,Full Stack JavaScript Developer,BEEDUCATION ADVENTURES SDN BHD,Subang Jaya,,"As a Full Stack JavaScript developer, you’ll collaborate with internal teams to develop functional applications, while working in a fast-paced environment."
124,Senior Android Developer,LCP Buildsoft Technology (M) Sdn Bhd,Klang,"RM 3,500 - RM 7,000 a month","Design, develop, integrate third-party components, test, install, and support.
Build new product features on server and client side."
125,Android Developer,SCIKEY,Kuala Lumpur,,"To this end, the Android Developer's Responsibilities include writing and proofreading code, liaising with coworkers within and outside of their department, and…"
126,Full Stack JaveScript Developer,ACD Development Sdn. Bhd,Subang Jaya,,"As a Full Stack JavaScript developer, you’ll collaborate with internal teams to develop functional applications, while working in a fast-paced environment."
127,Senior Software Engineer,Motorola Solutions,Penang,,And in everyday moments — when a package arrives just in time for the holiday or when a child doesn’t miss the school bus home.
128,Software Engineer / Web Developer,EasyStore,Puchong,"RM 4,000 - RM 8,000 a month","Manage codes in multiple server environment.
Optimize codes for high volume transaction.
Love to solve problems with coding."
129,Software Developer/Programmer,FUSIONQB SDN BHD,Bangsar South,"RM 3,500 - RM 8,000 a month","Build prototypes for presentation and demonstration.
Liaise with the senior executives and project sponsors for project requirements and deliverables."
130,Software Developer (Backend),SCIKEY,Kuala Lumpur,,"Manage the development of software programs and IT systems according to detailed.
Technical specifications using quality processes, tools and methodologies."
131,Software Developer (Flutter Experience)-Mandarin Speaker Pre...,Two95 International Inc.,Selangor,"RM 3,000 - RM 6,500 a month","Design, implement & manage apps that can scale and serve millions of users.
Design and implement RESTful and GraphQL API."
132,Android Software Engineer,EPS Malaysia,Cyberjaya,,"Work on defining and implementing next generation, innovative architecture for Android mobile application.
Apply state of the art automated testing practices …"
133,3D/Web GL Developer,Brand International,Kuala Lumpur,"RM 4,000 - RM 7,000 a month","Design to scale from phones to tablets to desktop monitors.
Create AI-powered interactive 3D assets using WebGL, three.js or new web 3d framework/library."
134,"Lead, QA",Career Channel,Petaling Jaya,,"Serves as the QA Team Lead, responsible for Test Automation.
Lead approximately 4 QA, negotiate scope, develop estimates, plans, monitoring metrics, and provide…"
135,Quality Assurance Lead (Automation),Career Channel,Petaling Jaya,,"Serves as the QA Team Lead, responsible for Test Automation.
Lead approximately 4 QA, negotiate scope, develop estimates, plans, monitoring metrics, and provide…"
136,Senior Engineer/Engineer Mobile,Carsome,Petaling Jaya,,"This person will own software quality assurance, working directly with backend developers project leads and software testers."
137,"Senior Engineer, QA",Career Channel,Petaling Jaya,,"QA engineer responsibilities include designing and implementing tests, debugging and defining corrective actions."
138,Engineer/Sr. Engineer - Full Stack,Carsome,Petaling Jaya,,You will cooperate with interdisciplinary teams in projects and experience how technology and team spirit unite to create innovative solutions.
139,Lead Engineering,Carsome Sdn Bhd,Selangor,,"Utilize a hands-on and adaptable leadership style with a commitment to accountability and driving results.
Proficient working with relational databases (MySQL),…"
140,Lead Engineering,Carsome Sdn Bhd,Selangor,,"Utilize a hands-on and adaptable leadership style with a commitment to accountability and driving results.
Proficient working with relational databases (MySQL),…"
141,Lead Engineering,SCIKEY,Petaling Jaya,,"Full Time/Permanent (hiring on behalf).
Utilize a hands-on and adaptable leadership style with a commitment to accountability and driving results."
