,title,company,salary,description
117,Software Developer (Backend),SCIKEY,,"Manage the development of software programs and IT systems according to detailed.
Technical specifications using quality processes, tools and methodologies."
118,Quality Assurance Lead (Automation),Career Channel,,"Serves as the QA Team Lead, responsible for Test Automation.
Lead approximately 4 QA, negotiate scope, develop estimates, plans, monitoring metrics, and provide…"
119,"Senior Engineer, QA",Career Channel,,"QA engineer responsibilities include designing and implementing tests, debugging and defining corrective actions."
120,Senior Engineer/Engineer Mobile,Carsome,,"This person will own software quality assurance, working directly with backend developers project leads and software testers."
121,Software Developer (Flutter Experience)-Mandarin Speaker Pre...,Two95 International Inc.,"RM 3,000 - RM 6,500 a month","Design, implement & manage apps that can scale and serve millions of users.
Design and implement RESTful and GraphQL API."
122,Ionic Mobile Application Developer (Fulltime),GO CLASS SDN BHD,"RM 4,000 - RM 5,000 a month","Minimum 2 years experience in Ionic / Flutter or other mobile app development.
Excellent in JavaScript, Typescript, SCSS, and other related languages."
123,Engineer/Sr. Engineer - Full Stack,Carsome,,You will cooperate with interdisciplinary teams in projects and experience how technology and team spirit unite to create innovative solutions.
124,Lead Engineering,SCIKEY,,"Full Time/Permanent (hiring on behalf).
Utilize a hands-on and adaptable leadership style with a commitment to accountability and driving results."
