,title,company,salary,description
115,IOS Developer,Capgemini Services Malaysia Sdn Bhd,,"You should have a strong knowledge of iOS frameworks and proficiency in Objective-C.
If you have knowledge of iOS patterns and practices and are passionate…"
116,Full Stack JaveScript Developer,ACD Development Sdn. Bhd,,"As a Full Stack JavaScript developer, you’ll collaborate with internal teams to develop functional applications, while working in a fast-paced environment."
117,Full Stack JavaScript Developer,BEEDUCATION ADVENTURES SDN BHD,,"As a Full Stack JavaScript developer, you’ll collaborate with internal teams to develop functional applications, while working in a fast-paced environment."
118,iOS/Android Developer,Nustax Sdn Bhd,,"Handle maintenance of mobile apps such as bug fixes and version updates.
Ensure work delivered in timely manner • Effective and work quickly with team members…"
119,"Mobile Application Developer I 5 days I Up to SGD6,000",Agensi Pekerjaan Nala Sdn Bhd,, Familiar with NoSQL and/or cloud database (Cloud Firestore or MongoDB) and experience with flutter Programming language.
120,Android Developer,SCIKEY,,"To this end, the Android Developer's Responsibilities include writing and proofreading code, liaising with coworkers within and outside of their department, and…"
121,Senior Android Developer,LCP Buildsoft Technology (M) Sdn Bhd,"RM 3,500 - RM 7,000 a month","Design, develop, integrate third-party components, test, install, and support.
Build new product features on server and client side."
122,Senior Engineer/Engineer R&D,Carsome,,"The Senior R&D Engineer will focus more on exploring new technologies, framework, or platform for upcoming projects."
123,Software Developer/Programmer,FUSIONQB SDN BHD,"RM 3,500 - RM 8,000 a month","Build prototypes for presentation and demonstration.
Liaise with the senior executives and project sponsors for project requirements and deliverables."
124,Philippines Job - Front End Developer (iGaming Industry),HWGZ Recruitment Services,"RM 16,000 - RM 25,000 a month","An online gaming company licensed under PAGCOR of Philippines with 2,000 staff in Philippines and Dubai.
不依赖脚手架搭建项目架构,比如vue-cli、create-react-app cli、angular…"
125,"Lead, QA",Career Channel,,"Serves as the QA Team Lead, responsible for Test Automation.
Lead approximately 4 QA, negotiate scope, develop estimates, plans, monitoring metrics, and provide…"
126,Software Developer,SCIKEY,,"Delivery & Execution capability, within the IT Operating Model.
The Software Developer is expected to manage the software building and system development."
127,Software Developer (Frontend),SCIKEY,,"Manage the development of software programs and IT systems according to detailed.
Technical specifications using quality processes, tools and methodologies."
128,Android Software Engineer,EPS Malaysia,,"Work on defining and implementing next generation, innovative architecture for Android mobile application.
Apply state of the art automated testing practices …"
129,Software Developer (Backend),SCIKEY,,"Manage the development of software programs and IT systems according to detailed.
Technical specifications using quality processes, tools and methodologies."
130,Quality Assurance Lead (Automation),Career Channel,,"Serves as the QA Team Lead, responsible for Test Automation.
Lead approximately 4 QA, negotiate scope, develop estimates, plans, monitoring metrics, and provide…"
131,Mobile Developer (iOS/Android),Robert Walters,,"In this business critical role, you will be working together with the team to develop high-quality applications, where you will be involved in technical…"
132,"Senior Engineer, QA",Career Channel,,"QA engineer responsibilities include designing and implementing tests, debugging and defining corrective actions."
133,Senior Engineer/Engineer Mobile,Carsome,,"This person will own software quality assurance, working directly with backend developers project leads and software testers."
134,Software Developer (Flutter Experience)-Mandarin Speaker Pre...,Two95 International Inc.,"RM 3,000 - RM 6,500 a month","Design, implement & manage apps that can scale and serve millions of users.
Design and implement RESTful and GraphQL API."
135,Engineer/Sr. Engineer - Full Stack,Carsome,,You will cooperate with interdisciplinary teams in projects and experience how technology and team spirit unite to create innovative solutions.
136,Ionic Mobile Application Developer (Fulltime),GO CLASS SDN BHD,"RM 4,000 - RM 5,000 a month","Minimum 2 years experience in Ionic / Flutter or other mobile app development.
Excellent in JavaScript, Typescript, SCSS, and other related languages."
137,Lead Engineering,SCIKEY,,"Full Time/Permanent (hiring on behalf).
Utilize a hands-on and adaptable leadership style with a commitment to accountability and driving results."
138,Senior Software Engineer (Frontend),iPrice group,,"Work in a Booming Sector with Exciting Challenges.
Deliver user stories that crafting front end components using HTML5, CSS3, JavaScript 6, AJAX and PHP."
